,tweet_id,in_reply_to_status_id,in_reply_to_user_id,timestamp,text,expanded_urls,rating_numerator,rating_denominator,name,user_followers,retweet,favorite,source_link,source_text,dog_etape
965,714251586676113411,,,2016-03-28 00:43:43,This is Thumas. He hates potted plants. 8/10 wtf Thumas https://t.co/rDVueNIcEi,https://twitter.com/dog_rates/status/714251586676113411/photo/1,8,10,Thumas,114031,940,3570,http://twitter.com/download/iphone,Twitter for iPhone,
966,714214115368108032,,,2016-03-27 22:14:49,Happy Easter from the squad! ðŸ‡ðŸ¶ 13/10 for all https://t.co/YMx4KWJUAB,https://twitter.com/dog_rates/status/714214115368108032/photo/1,13,10,,114031,990,2480,http://twitter.com/download/iphone,Twitter for iPhone,
967,714141408463036416,,,2016-03-27 17:25:54,"I know we only rate dogs, but since it's Easter I guess we could rate a bunny for a change. 10/10 petable as hell https://t.co/O2RlKXigHu",https://twitter.com/dog_rates/status/714141408463036416/photo/1,10,10,,114031,1569,4673,http://twitter.com/download/iphone,Twitter for iPhone,
968,713919462244790272,,,2016-03-27 02:43:58,This is Kanu. He's a Freckled Ticonderoga. Simply flawless. 12/10 would perform an elaborate heist to capture https://t.co/7vyAzIURrE,https://twitter.com/dog_rates/status/713919462244790272/photo/1,12,10,Kanu,114031,869,3564,http://twitter.com/download/iphone,Twitter for iPhone,
969,713900603437621249,,,2016-03-27 01:29:02,Happy Saturday here's 9 puppers on a bench. 99/90 good work everybody https://t.co/mpvaVxKmc1,https://twitter.com/dog_rates/status/713900603437621249/photo/1,99,90,,114031,829,3062,http://twitter.com/download/iphone,Twitter for iPhone,
970,713761197720473600,,,2016-03-26 16:15:05,This is Piper. She would really like that tennis ball core. Super sneaky tongue slip. 12/10 precious af https://t.co/QP6GHi5az9,https://twitter.com/dog_rates/status/713761197720473600/photo/1,12,10,Piper,114031,1541,5308,http://twitter.com/download/iphone,Twitter for iPhone,
971,713411074226274305,,,2016-03-25 17:03:49,Here we see an extremely rare Bearded Floofmallow. Only a few left in the wild. 11/10 would pet with a purpose https://t.co/jVJJKlPbvq,https://twitter.com/dog_rates/status/713411074226274305/photo/1,11,10,,114031,1440,4802,http://twitter.com/download/iphone,Twitter for iPhone,
972,713177543487135744,,,2016-03-25 01:35:51,This is Lance. Lance doesn't give a shit. 10/10 we should all be more like Lance https://t.co/SqnG9Ap28J,https://twitter.com/dog_rates/status/713177543487135744/photo/1,10,10,Lance,114031,3183,7854,http://twitter.com/download/iphone,Twitter for iPhone,
973,713175907180089344,,,2016-03-25 01:29:21,Say hello to Opie and Clarkus. Clarkus fell asleep so Opie buried him. Ruthless af 10/10 for both https://t.co/xT7XaY4gnW,https://twitter.com/dog_rates/status/713175907180089344/photo/1,10,10,Opie,114031,1630,4851,http://twitter.com/download/iphone,Twitter for iPhone,
974,712809025985978368,,,2016-03-24 01:11:29,This is Stubert. He just arrived. 10/10 https://t.co/HVGs5aAKAn,https://twitter.com/dog_rates/status/712809025985978368/photo/1,10,10,Stubert,114031,7602,20378,http://twitter.com/download/iphone,Twitter for iPhone,
975,712717840512598017,,,2016-03-23 19:09:09,Please don't send in any more polar bears. We only rate dogs. Thank you... 10/10 https://t.co/83RGhdIQz2,https://twitter.com/dog_rates/status/712717840512598017/photo/1,10,10,,114031,5616,13474,http://twitter.com/download/iphone,Twitter for iPhone,
976,712668654853337088,,,2016-03-23 15:53:42,Say hello to Sunny and Roxy. They pull things out of water together. 10/10 for both https://t.co/88aedAmxcl,https://twitter.com/dog_rates/status/712668654853337088/photo/1,10,10,Sunny,114031,1367,4531,http://twitter.com/download/iphone,Twitter for iPhone,
977,712438159032893441,,,2016-03-23 00:37:48,This is Kane. He's a semi-submerged Haitian Huffleplop. Happy af. Sick waterfall. 11/10 would pat head approvingly https://t.co/7zjEC501Ul,https://twitter.com/dog_rates/status/712438159032893441/photo/1,11,10,Kane,114031,1756,5799,http://twitter.com/download/iphone,Twitter for iPhone,
978,712097430750289920,,,2016-03-22 02:03:52,I can't even comprehend how confused this dog must be right now. 10/10 https://t.co/8AGcQ4hIfK,https://twitter.com/dog_rates/status/712097430750289920/photo/1,10,10,,114031,1172,4144,http://twitter.com/download/iphone,Twitter for iPhone,
979,712092745624633345,,,2016-03-22 01:45:15,This is Steven. He's inverted af. Also very helpful. Scans anything you want for free. Takes him a while tho. 7/10 https://t.co/tA0ZiQ7JcG,https://twitter.com/dog_rates/status/712092745624633345/photo/1,7,10,Steven,114031,1016,3211,http://twitter.com/download/iphone,Twitter for iPhone,
980,712085617388212225,,,2016-03-22 01:16:55,"Say hello to Olive and Ruby. They are best buddies. Both 11/10 
1 like = 1 buddy https://t.co/yagmFdKlyL",https://twitter.com/dog_rates/status/712085617388212225/photo/1,11,10,Olive,114031,556,3531,http://twitter.com/download/iphone,Twitter for iPhone,
981,712065007010385924,,,2016-03-21 23:55:01,This is Chester. He's clearly in charge of the other dogs. Weird ass paws. Not fit for fetch. 6/10 would still pet https://t.co/o2GvskrhHt,https://twitter.com/dog_rates/status/712065007010385924/photo/1,6,10,Chester,114031,700,2451,http://twitter.com/download/iphone,Twitter for iPhone,
982,711968124745228288,,,2016-03-21 17:30:03,Meet Winston. He's trapped in a cup of coffee. Poor pupper. 10/10 someone free him https://t.co/2e6cUtKUuc,https://twitter.com/dog_rates/status/711968124745228288/photo/1,10,10,Winston,114031,2601,8776,http://twitter.com/download/iphone,Twitter for iPhone,pupper
983,711743778164514816,,,2016-03-21 02:38:34,Meet Roosevelt. He's calculating the best case scenario if he drops out instead of doing math hw. 11/10 relatable af https://t.co/QcSIRDpfVg,https://twitter.com/dog_rates/status/711743778164514816/photo/1,11,10,Roosevelt,114031,1101,3095,http://twitter.com/download/iphone,Twitter for iPhone,
984,711732680602345472,,,2016-03-21 01:54:29,I want to hear the joke this dog was just told. 10/10 https://t.co/1KiuZqqOD4,https://twitter.com/dog_rates/status/711732680602345472/photo/1,10,10,,114031,4653,9756,http://twitter.com/download/iphone,Twitter for iPhone,
985,711694788429553666,,,2016-03-20 23:23:54,Oh. My. God. 13/10 magical af https://t.co/Ezu6jQrKAZ,https://twitter.com/dog_rates/status/711694788429553666/photo/1,13,10,,114031,20500,35865,http://twitter.com/download/iphone,Twitter for iPhone,
986,711652651650457602,,,2016-03-20 20:36:28,This is Gary. He just wanted to say hi. 9/10 very personable pup https://t.co/Sk3CbhmKSW,https://twitter.com/dog_rates/status/711652651650457602/photo/1,9,10,Gary,114031,1037,4228,http://twitter.com/download/iphone,Twitter for iPhone,
987,711363825979756544,,,2016-03-20 01:28:47,"""Please, no puparazzi"" 11/10 https://t.co/nJIXSPfedK",https://twitter.com/dog_rates/status/711363825979756544/photo/1,11,10,,114031,1287,3996,http://twitter.com/download/iphone,Twitter for iPhone,
988,711306686208872448,,,2016-03-19 21:41:44,What hooligan sent in pictures w/out a dog in them? Churlish af. 3/10 just bc that's a neat fluffy bean bag chair https://t.co/wcwoGOkZvz,https://twitter.com/dog_rates/status/711306686208872448/photo/1,3,10,,114031,819,3596,http://twitter.com/download/iphone,Twitter for iPhone,
989,711008018775851008,,,2016-03-19 01:54:56,This is Chuckles. He had a balloon but he accidentally let go of it and it floated away. 11/10 hang in there pupper https://t.co/68iNM7B5gW,https://twitter.com/dog_rates/status/711008018775851008/photo/1,11,10,Chuckles,114031,710,3275,http://twitter.com/download/iphone,Twitter for iPhone,pupper
990,710997087345876993,,,2016-03-19 01:11:29,Meet Milo and Amos. They are the best of pals. Both 12/10 would pet at the same time https://t.co/Mv37BHEyyD,https://twitter.com/dog_rates/status/710997087345876993/photo/1,12,10,Milo,114031,1561,4960,http://twitter.com/download/iphone,Twitter for iPhone,
991,710844581445812225,,,2016-03-18 15:05:29,This is Staniel. His selfie game is strong af. 10/10 I'd snapchat with Staniel https://t.co/UgkTw7TKyM,https://twitter.com/dog_rates/status/710844581445812225/photo/1,10,10,Staniel,114031,779,2775,http://twitter.com/download/iphone,Twitter for iPhone,
992,710833117892898816,,,2016-03-18 14:19:56,Say hello to Sora. She's an Egyptian Pumpernickel. Mesmerizing af. 12/10 would bring home to mom https://t.co/PmTR4kxZkq,https://twitter.com/dog_rates/status/710833117892898816/photo/1,12,10,Sora,114031,606,2937,http://twitter.com/download/iphone,Twitter for iPhone,
993,710658690886586372,,,2016-03-18 02:46:49,Here's a brigade of puppers. All look very prepared for whatever happens next. 80/80 https://t.co/0eb7R1Om12,https://twitter.com/dog_rates/status/710658690886586372/photo/1,80,80,,114031,636,2529,http://twitter.com/download/iphone,Twitter for iPhone,
994,710588934686908417,,,2016-03-17 22:09:38,This is Beemo. He's a Chubberflop mix. 12/10 would cross the world for https://t.co/kzMVMU8HBV,https://twitter.com/dog_rates/status/710588934686908417/photo/1,12,10,Beemo,114031,2107,4968,http://twitter.com/download/iphone,Twitter for iPhone,
995,710283270106132480,,,2016-03-17 01:55:02,This is Gunner. He's a Figamus Newton. King of the peek-a-boo. Cool jeans. 11/10 https://t.co/ONuBILIYXZ,https://twitter.com/dog_rates/status/710283270106132480/photo/1,11,10,Gunner,114031,580,2308,http://twitter.com/download/iphone,Twitter for iPhone,
996,710272297844797440,,,2016-03-17 01:11:26,We ðŸ‘ðŸ» only ðŸ‘ðŸ» rate ðŸ‘ðŸ» dogs. Pls stop sending in non-canines like this Dutch Panda Worm. This is infuriating. 11/10 https://t.co/odfLzBonG2,https://twitter.com/dog_rates/status/710272297844797440/photo/1,11,10,infuriating,114031,1425,4945,http://twitter.com/download/iphone,Twitter for iPhone,
997,710269109699739648,,,2016-03-17 00:58:46,"The squad is back for St. Patrick's Day! â˜˜ ðŸ’š
13/10 for all https://t.co/OcCDb2bng5",https://twitter.com/dog_rates/status/710269109699739648/photo/1,13,10,,114031,1257,2613,http://twitter.com/download/iphone,Twitter for iPhone,
998,710153181850935296,,,2016-03-16 17:18:07,This is Lacy. She's tipping her hat to you. Daydreams of her life back on the frontier. 11/10 would pet so well https://t.co/fG5Pk3Et1I,https://twitter.com/dog_rates/status/710153181850935296/photo/1,11,10,Lacy,114031,1006,3153,http://twitter.com/download/iphone,Twitter for iPhone,
999,710140971284037632,,,2016-03-16 16:29:35,This is Tater. His underbite is fierce af. Doesn't give a damn about your engagement photo. 8/10 https://t.co/nLuPY3pY12,https://twitter.com/dog_rates/status/710140971284037632/photo/1,8,10,Tater,114031,1008,3017,http://twitter.com/download/iphone,Twitter for iPhone,
1000,710117014656950272,,,2016-03-16 14:54:24,This pupper got her hair chalked for her birthday. Hasn't told her parents yet. Rebellious af. 11/10 very nifty https://t.co/h1OX2mLtxV,https://twitter.com/dog_rates/status/710117014656950272/photo/1,11,10,,114031,2233,5999,http://twitter.com/download/iphone,Twitter for iPhone,pupper
1001,709918798883774466,,,2016-03-16 01:46:45,Meet Watson. He's a Suzuki Tickleboop. Leader of a notorious biker gang. Only one ear functional. 12/10 snuggable af https://t.co/R1gLc5vDqG,https://twitter.com/dog_rates/status/709918798883774466/photo/1,12,10,Watson,114031,1215,3250,http://twitter.com/download/iphone,Twitter for iPhone,
1002,709901256215666688,,,2016-03-16 00:37:03,"WeRateDogs stickers are here and they're 12/10! Use code ""puppers"" at checkout ðŸ¶ðŸ¾

Shop now: https://t.co/k5xsufRKYm https://t.co/ShXk46V13r",https://twitter.com/dog_rates/status/709901256215666688/photo/1,12,10,,114031,112,732,http://twitter.com/download/iphone,Twitter for iPhone,
1003,709852847387627521,,,2016-03-15 21:24:41,*lets out a tiny whimper and then collapses* ...12/10 https://t.co/BNdVZEHRow,https://twitter.com/dog_rates/status/709852847387627521/photo/1,12,10,,114031,1336,3824,http://twitter.com/download/iphone,Twitter for iPhone,
1004,709566166965075968,,,2016-03-15 02:25:31,This is Olaf. He's gotta be rare. Seems sturdy. Tail is floofy af. 12/10 would do whatever it takes to pet https://t.co/E9jaU59bh9,https://twitter.com/dog_rates/status/709566166965075968/photo/1,12,10,Olaf,114031,1367,3865,http://twitter.com/download/iphone,Twitter for iPhone,
1005,709556954897764353,,,2016-03-15 01:48:55,This is Cecil. She's a Gigglefloof Poofer. Outdoorsy af. One with nature. 12/10 would strategically capture https://t.co/ijJB0DuOIC,https://twitter.com/dog_rates/status/709556954897764353/photo/1,12,10,Cecil,114031,1204,3593,http://twitter.com/download/iphone,Twitter for iPhone,
1006,709519240576036864,,,2016-03-14 23:19:03,This is Vince. He's a Gregorian Flapjeck. White spot on legs almost looks like another dog (whoa). 9/10 rad as hell https://t.co/aczGAV2dK4,https://twitter.com/dog_rates/status/709519240576036864/photo/1,9,10,Vince,114031,277,1620,http://twitter.com/download/iphone,Twitter for iPhone,
1007,709449600415961088,,,2016-03-14 18:42:20,Meet Karma. She's just a head. Lost body during the Second Punic War (unfortunate). Loves to travel 10/10 petable af https://t.co/c6af6nYEPo,https://twitter.com/dog_rates/status/709449600415961088/photo/1,10,10,Karma,114031,665,2420,http://twitter.com/download/iphone,Twitter for iPhone,
1008,709409458133323776,,,2016-03-14 16:02:49,This is Billy. He sensed a squirrel. 8/10 damn it Billy https://t.co/Yu0K98VZ9A,https://twitter.com/dog_rates/status/709409458133323776/photo/1,8,10,Billy,114031,788,2855,http://twitter.com/download/iphone,Twitter for iPhone,
1009,709225125749587968,,,2016-03-14 03:50:21,This is Walker. He's a Butternut Khalifa. Appears fuzzy af. 11/10 would hug for a ridiculous amount of time https://t.co/k6fEWHSALn,https://twitter.com/dog_rates/status/709225125749587968/photo/1,11,10,Walker,114031,647,2615,http://twitter.com/download/iphone,Twitter for iPhone,
1010,709207347839836162,,,2016-03-14 02:39:42,This is Penny. She's trying on her prom dress. Stunning af 11/10 https://t.co/qcZDZGCapg,https://twitter.com/dog_rates/status/709207347839836162/photo/1,11,10,Penny,114031,6567,13755,http://twitter.com/download/iphone,Twitter for iPhone,
1011,709198395643068416,,,2016-03-14 02:04:08,"From left to right:
Cletus, Jerome, Alejandro, Burp, &amp; Titson
None know where camera is. 45/50 would hug all at once https://t.co/sedre1ivTK",https://twitter.com/dog_rates/status/709198395643068416/photo/1,45,50,,114031,721,2634,http://twitter.com/download/iphone,Twitter for iPhone,
1012,709158332880297985,,,2016-03-13 23:24:56,Meet Rodney. He's a Ukranian Boomchicka. Outside but would like to be inside. Only has one ear (unfortunate) 10/10 https://t.co/FjAj3ggXrR,https://twitter.com/dog_rates/status/709158332880297985/photo/1,10,10,Rodney,114031,470,2236,http://twitter.com/download/iphone,Twitter for iPhone,
1013,709042156699303936,,,2016-03-13 15:43:18,This is Klevin. He's addicted to sandwiches (yes a hotdog is a sandwich fight me) It's tearing his family apart 9/10 https://t.co/7BkkVNu5pd,https://twitter.com/dog_rates/status/709042156699303936/photo/1,9,10,Klevin,114031,1864,5197,http://twitter.com/download/iphone,Twitter for iPhone,
1014,708845821941387268,,,2016-03-13 02:43:08,Here's a pupper with magic eyes. Not wearing a seat belt tho (irresponsible af). Very distracting to driver. 9/10 https://t.co/5DLJB4ssvI,https://twitter.com/dog_rates/status/708845821941387268/photo/1,9,10,,114031,1015,3226,http://twitter.com/download/iphone,Twitter for iPhone,pupper
1015,708834316713893888,,,2016-03-13 01:57:25,Meet Malikai. He was rolling around having fun when he remembered the inevitable heat death of the universe. 10/10 https://t.co/Vd2FqHIIGn,https://twitter.com/dog_rates/status/708834316713893888/photo/1,10,10,Malikai,114031,571,1860,http://twitter.com/download/iphone,Twitter for iPhone,
1016,708810915978854401,,,2016-03-13 00:24:26,This is Mister. He's a wonderful father to his two pups. Heartwarming af. 10/10 for all https://t.co/2KcuJXL2r4,https://twitter.com/dog_rates/status/708810915978854401/photo/1,10,10,Mister,114031,7848,18036,http://twitter.com/download/iphone,Twitter for iPhone,
1017,708738143638450176,,,2016-03-12 19:35:15,This is Coco. She gets to stay on the Bachelor for another week. Super pumped 11/10 https://t.co/wsCB6LFNxD,https://twitter.com/dog_rates/status/708738143638450176/photo/1,11,10,Coco,114031,917,2997,http://twitter.com/download/iphone,Twitter for iPhone,
1018,708711088997666817,,,2016-03-12 17:47:45,This is Smokey. He really likes tennis balls. 11/10 https://t.co/Ah7WlYTUBQ,https://twitter.com/dog_rates/status/708711088997666817/photo/1,11,10,Smokey,114031,834,2790,http://twitter.com/download/iphone,Twitter for iPhone,
1019,708479650088034305,,,2016-03-12 02:28:06,Meet Bear. He's a Beneboop Cumberclap. Extremely unamused. 13/10 I'm in love with this picture https://t.co/uC8kUqAz0W,https://twitter.com/dog_rates/status/708479650088034305/photo/1,13,10,Bear,114031,765,2768,http://twitter.com/download/iphone,Twitter for iPhone,
1020,708469915515297792,,,2016-03-12 01:49:25,This is Bobble. He's a Croatian Galifianakis. Hears everything within 400 miles. 11/10 would snug diligently https://t.co/VwDc6PTDzk,https://twitter.com/dog_rates/status/708469915515297792/photo/1,11,10,Bobble,114031,926,3357,http://twitter.com/download/iphone,Twitter for iPhone,
1021,708356463048204288,,,2016-03-11 18:18:36,This is Oliver. That is his castle. He protects it with his life. He's also squishy af. 10/10 would squish softly https://t.co/oSuEGw0BhX,https://twitter.com/dog_rates/status/708356463048204288/photo/1,10,10,Oliver,114031,1520,3929,http://twitter.com/download/iphone,Twitter for iPhone,
1022,708349470027751425,,,2016-03-11 17:50:48,This is River. He's changing the trumpet game. Innovative af. 11/10 such a good boy https://t.co/tK7a0AxQfd,https://twitter.com/dog_rates/status/708349470027751425/photo/1,11,10,River,114031,831,2568,http://twitter.com/download/iphone,Twitter for iPhone,
1023,708149363256774660,,,2016-03-11 04:35:39,This is Jebberson. He's the reigning hide and seek world champion. 10/10 hasn't lost his touch https://t.co/VEFkvWCoHF,https://twitter.com/dog_rates/status/708149363256774660/photo/1,10,10,Jebberson,114031,1727,4672,http://twitter.com/download/iphone,Twitter for iPhone,
1024,708130923141795840,,,2016-03-11 03:22:23,Please stop sending in non canines like this Guatemalan Twiggle Bunny. We only rate dogs. Only send in dogs... 11/10 https://t.co/XKhobeGuvT,https://twitter.com/dog_rates/status/708130923141795840/photo/1,11,10,,114031,943,3707,http://twitter.com/download/iphone,Twitter for iPhone,
1025,708119489313951744,,,2016-03-11 02:36:57,This is Cooper. He basks in the glory of rebellion. 9/10 probably a preteen https://t.co/kDamUfeIpm,https://twitter.com/dog_rates/status/708119489313951744/photo/1,9,10,Cooper,114031,1102,2937,http://twitter.com/download/iphone,Twitter for iPhone,
1026,708109389455101952,,,2016-03-11 01:56:49,This is Remington. He was caught off guard by the magical floating cheese. Spooked af. 10/10 deep breaths pup https://t.co/mhPSADiJmZ,https://twitter.com/dog_rates/status/708109389455101952/photo/1,10,10,Remington,114031,610,2124,http://twitter.com/download/iphone,Twitter for iPhone,
1027,708026248782585858,,,2016-03-10 20:26:26,Everybody stop what you're doing and watch this video. Frank is stuck in a loop. 13/10 (Vid by @klbmatty) https://t.co/5AJs8TIV1U,https://twitter.com/dog_rates/status/708026248782585858/video/1,13,10,,114031,2166,4799,http://twitter.com/download/iphone,Twitter for iPhone,
1028,707995814724026368,,,2016-03-10 18:25:30,This is Farfle. He lost his back legs during the Battle of Gettysburg. Goes 0-60 in 4.3 seconds (damn) 12/10 hero af https://t.co/NiQQWzIzzq,https://twitter.com/dog_rates/status/707995814724026368/photo/1,12,10,Farfle,114031,1273,3385,http://twitter.com/download/iphone,Twitter for iPhone,
1029,707983188426153984,7.079800658926674e+17,2319108198.0,2016-03-10 17:35:20,@serial @MrRoles OH MY GOD I listened to all of season 1 during a single road trip. I love you guys! I can confirm Bernie's 12/10 rating :),,12,10,,114031,2,52,http://twitter.com/download/iphone,Twitter for iPhone,
1030,707969809498152960,,,2016-03-10 16:42:10,Meet Rufus. He's a Honeysuckle Firefox. Curly af. Badass tie. About to go on his first date ever 11/10 good luck pup https://t.co/dGoTWNfIsm,https://twitter.com/dog_rates/status/707969809498152960/photo/1,11,10,Rufus,114031,1097,2941,http://twitter.com/download/iphone,Twitter for iPhone,
1031,707776935007539200,,,2016-03-10 03:55:45,This is Sadie. She's a Bohemian Rhapsody. Remarkably portable. Could sneak on roller coasters with (probably). 11/10 https://t.co/DB8fyeDs8B,https://twitter.com/dog_rates/status/707776935007539200/photo/1,11,10,Sadie,114031,1079,3593,http://twitter.com/download/iphone,Twitter for iPhone,
1032,707741517457260545,,,2016-03-10 01:35:01,When your roommate eats your leftover Chili's but you pretend it's no big deal cuz you fat anyway. 10/10 head up pup https://t.co/0nMgoue8IR,https://twitter.com/dog_rates/status/707741517457260545/photo/1,10,10,,114031,696,2718,http://twitter.com/download/iphone,Twitter for iPhone,
1033,707693576495472641,,,2016-03-09 22:24:31,This is Jiminus. He's in a tub for some reason. What a jokester. Smh 7/10 churlish af https://t.co/84L4ED9Tpi,https://twitter.com/dog_rates/status/707693576495472641/photo/1,7,10,Jiminus,114031,1133,3765,http://twitter.com/download/iphone,Twitter for iPhone,
1034,707610948723478529,,,2016-03-09 16:56:11,This is Harper. She scraped her elbow attempting a backflip off a tree. Valiant effort tho. 12/10 https://t.co/oHKJHghrp5,https://twitter.com/dog_rates/status/707610948723478529/photo/1,12,10,Harper,114031,7236,18557,http://twitter.com/download/iphone,Twitter for iPhone,
1035,707420581654872064,,,2016-03-09 04:19:44,This is Keurig. He's a rare dog. Laughs like an idiot tho. Head is basically a weapon. Poorly maintained goatee 4/10 https://t.co/xOrUyj7K30,https://twitter.com/dog_rates/status/707420581654872064/photo/1,4,10,Keurig,114031,789,2499,http://twitter.com/download/iphone,Twitter for iPhone,
1036,707411934438625280,,,2016-03-09 03:45:22,"""I shall trip the big pupper with leash. Big pupper will never see it coming. I am a genius."" Both 11/10 https://t.co/uQsCJ8pf51",https://twitter.com/dog_rates/status/707411934438625280/photo/1,11,10,,114031,673,2486,http://twitter.com/download/iphone,Twitter for iPhone,pupper
1037,707387676719185920,,,2016-03-09 02:08:59,Meet Clarkus. He's a Skinny Eastern Worcestershire. Can tie own shoes (impressive af) 10/10 would put on track team https://t.co/XP5o7zGn0E,https://twitter.com/dog_rates/status/707387676719185920/photo/1,10,10,Clarkus,114031,1490,3835,http://twitter.com/download/iphone,Twitter for iPhone,
1038,707377100785885184,,,2016-03-09 01:26:57,This dog just brutally murdered a snowman. Currently toying with its nutritious remains 9/10 would totally still pet https://t.co/iKThgKnW1j,https://twitter.com/dog_rates/status/707377100785885184/photo/1,9,10,,114031,1214,3603,http://twitter.com/download/iphone,Twitter for iPhone,
1039,707315916783140866,,,2016-03-08 21:23:50,This is Finnegus. He's trapped in a snow globe. Poor pupper. 10/10 would make sure no one shook it https://t.co/BjpOa52jQ4,https://twitter.com/dog_rates/status/707315916783140866/photo/1,10,10,Finnegus,114031,727,2698,http://twitter.com/download/iphone,Twitter for iPhone,pupper
1040,707297311098011648,,,2016-03-08 20:09:54,This is Cassie. She can go from sweet to scary af in a matter of seconds. 10/10 points deducted for cats on pajamas https://t.co/B6dmZmJBdK,https://twitter.com/dog_rates/status/707297311098011648/photo/1,10,10,Cassie,114031,903,3022,http://twitter.com/download/iphone,Twitter for iPhone,
1041,707059547140169728,,,2016-03-08 04:25:07,Say hello to Cupcake. She's an Icelandic Dippen Dot. Confused by the oddly geometric lawn pattern. 11/10 https://t.co/D7rorf4YKL,https://twitter.com/dog_rates/status/707059547140169728/photo/1,11,10,Cupcake,114031,759,2796,http://twitter.com/download/iphone,Twitter for iPhone,
1042,707038192327901184,,,2016-03-08 03:00:15,This is Kathmandu. He sees every move you make. Probably knows Jiu-Jitsu. 10/10 mysterious af https://t.co/z0cs7E4Xjj,https://twitter.com/dog_rates/status/707038192327901184/photo/1,10,10,Kathmandu,114031,900,2404,http://twitter.com/download/iphone,Twitter for iPhone,
1043,707021089608753152,,,2016-03-08 01:52:18,This is Tucker. He's a Dasani Episcopalian. Good lord what a tongue. 12/10 would never let go of https://t.co/gHtW5cgyy7,https://twitter.com/dog_rates/status/707021089608753152/photo/1,12,10,Tucker,114031,1540,4433,http://twitter.com/download/iphone,Twitter for iPhone,
1044,707014260413456384,,,2016-03-08 01:25:10,This is Ellie. She requests to be carried around in a lacrosse stick at all times. 11/10 impossible to say no https://t.co/15yCmd43zU,https://twitter.com/dog_rates/status/707014260413456384/photo/1,11,10,Ellie,114031,664,2502,http://twitter.com/download/iphone,Twitter for iPhone,
1045,706901761596989440,,,2016-03-07 17:58:08,This is Elliot. He's blocking the roadway. Downright rude as hell. Doesn't care that you're already late. 3/10 https://t.co/FMUxir5pYu,https://twitter.com/dog_rates/status/706901761596989440/photo/1,3,10,Elliot,114031,680,2264,http://twitter.com/download/iphone,Twitter for iPhone,
1046,706681918348251136,,,2016-03-07 03:24:33,Say hello to Katie. She's a Mitsubishi Hufflepuff. Curly af. 12/10 I'd do terrible things to acquire such a pup https://t.co/CFPIcGcwJv,https://twitter.com/dog_rates/status/706681918348251136/photo/1,12,10,Katie,114031,1103,3627,http://twitter.com/download/iphone,Twitter for iPhone,
