tweet_id,in_reply_to_status_id,in_reply_to_user_id,timestamp,text,expanded_urls,rating_numerator,rating_denominator,name,source_link,source_text,dog_etape,user_followers,retweet,favorite,jpg_url,img_num,p1,p1_conf,p1_dog,p2,p2_conf,p2_dog,p3,p3_conf,p3_dog
891815181378084864,,,2017-07-31 00:18:03,This is Archie. He is a rare Norwegian Pouncing Corgo. Lives in the tall grass. You never know when one may strike. 12/10 https://t.co/wUnZnhtVJB,https://twitter.com/dog_rates/status/891815181378084864/photo/1,12.0,10.0,Archie,http://twitter.com/download/iphone,Twitter for iPhone,,3200889,4328,25461,https://pbs.twimg.com/media/DGBdLU1WsAANxJ9.jpg,1,Chihuahua,0.716012,True,malamute,0.078253,True,kelpie,0.0313789,True
891689557279858688,,,2017-07-30 15:58:51,This is Darla. She commenced a snooze mid meal. 13/10 happens to the best of us https://t.co/tD36da7qLQ,https://twitter.com/dog_rates/status/891689557279858688/photo/1,13.0,10.0,Darla,http://twitter.com/download/iphone,Twitter for iPhone,,3200889,8964,42908,https://pbs.twimg.com/media/DF_q7IAWsAEuuN8.jpg,1,paper_towel,0.1702779999999999,False,Labrador_retriever,0.1680859999999999,True,spatula,0.0408359,False
891327558926688256,,,2017-07-29 16:00:24,"This is Franklin. He would like you to stop calling him ""cute."" He is a very fierce shark and should be respected as such. 12/10 #BarkWeek https://t.co/AtUZn91f7f",https://twitter.com/dog_rates/status/891327558926688256/photo/1,12.0,10.0,Franklin,http://twitter.com/download/iphone,Twitter for iPhone,,3200889,9774,41048,https://pbs.twimg.com/media/DF6hr6BUMAAzZgT.jpg,2,basset,0.555712,True,English_springer,0.2257699999999999,True,German_short-haired_pointer,0.175219,True
891087950875897856,,,2017-07-29 00:08:17,Here we have a majestic great white breaching off South Africa's coast. Absolutely h*ckin breathtaking. 13/10 (IG: tucker_marlo) #BarkWeek https://t.co/kQ04fDDRmh,https://twitter.com/dog_rates/status/891087950875897856/photo/1,13.0,10.0,,http://twitter.com/download/iphone,Twitter for iPhone,,3200889,3261,20562,https://pbs.twimg.com/media/DF3HwyEWsAABqE6.jpg,1,Chesapeake_Bay_retriever,0.425595,True,Irish_terrier,0.116317,True,Indian_elephant,0.0769021999999999,False
890729181411237888,,,2017-07-28 00:22:40,When you watch your owner call another dog a good boy but then they turn back to you and say you're a great boy. 13/10 https://t.co/v0nONBcwxq,https://twitter.com/dog_rates/status/890729181411237888/photo/1,13.0,10.0,,http://twitter.com/download/iphone,Twitter for iPhone,,3200889,16716,56848,https://pbs.twimg.com/media/DFyBahAVwAAhUTd.jpg,2,Pomeranian,0.566142,True,Eskimo_dog,0.1784059999999999,True,Pembroke,0.0765069,True
890609185150312448,,,2017-07-27 16:25:51,This is Zoey. She doesn't want to be one of the scary sharks. Just wants to be a snuggly pettable boatpet. 13/10 #BarkWeek https://t.co/9TwLuAGH0b,https://twitter.com/dog_rates/status/890609185150312448/photo/1,13.0,10.0,Zoey,http://twitter.com/download/iphone,Twitter for iPhone,,3200889,4429,28226,https://pbs.twimg.com/media/DFwUU__XcAEpyXI.jpg,1,Irish_terrier,0.4875739999999999,True,Irish_setter,0.193054,True,Chesapeake_Bay_retriever,0.118184,True
890006608113172480,,,2017-07-26 00:31:25,This is Koda. He is a South Australian deckshark. Deceptively deadly. Frighteningly majestic. 13/10 would risk a petting #BarkWeek https://t.co/dVPW0B0Mme,https://twitter.com/dog_rates/status/890006608113172480/photo/1,13.0,10.0,Koda,http://twitter.com/download/iphone,Twitter for iPhone,,3200889,7624,31166,https://pbs.twimg.com/media/DFnwSY4WAAAMliS.jpg,1,Samoyed,0.957979,True,Pomeranian,0.0138835,True,chow,0.00816748,True
889638837579907072,,,2017-07-25 00:10:02,This is Ted. He does his best. Sometimes that's not enough. But it's ok. 12/10 would assist https://t.co/f8dEDcrKSR,https://twitter.com/dog_rates/status/889638837579907072/photo/1,12.0,10.0,Ted,http://twitter.com/download/iphone,Twitter for iPhone,,3200889,4735,27672,https://pbs.twimg.com/media/DFihzFfXsAYGDPR.jpg,1,French_bulldog,0.99165,True,boxer,0.00212864,True,Staffordshire_bullterrier,0.00149818,True
889278841981685760,,,2017-07-24 00:19:32,This is Oliver. You're witnessing one of his many brutal attacks. Seems to be playing with his victim. 13/10 fr*ckin frightening #BarkWeek https://t.co/WpHvrQedPb,https://twitter.com/dog_rates/status/889278841981685760/video/1,13.0,10.0,Oliver,http://twitter.com/download/iphone,Twitter for iPhone,,3200889,5637,25652,https://pbs.twimg.com/ext_tw_video_thumb/889278779352338437/pu/img/VlbFB3v8H8VwzVNY.jpg,1,whippet,0.626152,True,borzoi,0.194742,True,Saluki,0.0273507,True
888917238123831296,,,2017-07-23 00:22:39,This is Jim. He found a fren. Taught him how to sit like the good boys. 12/10 for both https://t.co/chxruIOUJN,https://twitter.com/dog_rates/status/888917238123831296/photo/1,12.0,10.0,Jim,http://twitter.com/download/iphone,Twitter for iPhone,,3200889,4709,29611,https://pbs.twimg.com/media/DFYRgsOUQAARGhO.jpg,1,golden_retriever,0.714719,True,Tibetan_mastiff,0.1201839999999999,True,Labrador_retriever,0.1055059999999999,True
888554962724278272,,,2017-07-22 00:23:06,This is Ralphus. He's powering up. Attempting maximum borkdrive. 13/10 inspirational af https://t.co/YnYAFCTTiK,https://twitter.com/dog_rates/status/888554962724278272/photo/1,13.0,10.0,Ralphus,http://twitter.com/download/iphone,Twitter for iPhone,,3200889,3732,20290,https://pbs.twimg.com/media/DFTH_O-UQAACu20.jpg,3,Siberian_husky,0.700377,True,Eskimo_dog,0.166511,True,malamute,0.111411,True
888078434458587136,,,2017-07-20 16:49:33,This is Gerald. He was just told he didn't get the job he interviewed for. A h*ckin injustice. 12/10 didn't want the job anyway https://t.co/DK7iDPfuRX,https://twitter.com/dog_rates/status/888078434458587136/photo/1,12.0,10.0,Gerald,http://twitter.com/download/iphone,Twitter for iPhone,,3200889,3653,22201,https://pbs.twimg.com/media/DFMWn56WsAAkA7B.jpg,1,French_bulldog,0.995026,True,pug,0.000931908,True,bull_mastiff,0.000903211,True
887705289381826560,,,2017-07-19 16:06:48,This is Jeffrey. He has a monopoly on the pool noodles. Currently running a 'boop for two' midweek sale. 13/10 h*ckin strategic https://t.co/PhrUk20Q64,https://twitter.com/dog_rates/status/887705289381826560/photo/1,13.0,10.0,Jeffrey,http://twitter.com/download/iphone,Twitter for iPhone,,3200890,5609,30779,https://pbs.twimg.com/media/DFHDQBbXgAEqY7t.jpg,1,basset,0.821664,True,redbone,0.0875815,True,Weimaraner,0.0262364,True
887517139158093824,,,2017-07-19 03:39:09,I've yet to rate a Venezuelan Hover Wiener. This is such an honor. 14/10 paw-inspiring af (IG: roxy.thedoxy) https://t.co/20VrLAA8ba,https://twitter.com/dog_rates/status/887517139158093824/video/1,14.0,10.0,such,http://twitter.com/download/iphone,Twitter for iPhone,,3200890,12082,46959,https://pbs.twimg.com/ext_tw_video_thumb/887517108413886465/pu/img/WanJKwssZj4VJvL9.jpg,1,limousine,0.130432,False,tow_truck,0.0291754,False,shopping_cart,0.0263208,False
887343217045368832,,,2017-07-18 16:08:03,You may not have known you needed to see this today. 13/10 please enjoy (IG: emmylouroo) https://t.co/WZqNqygEyV,https://twitter.com/dog_rates/status/887343217045368832/video/1,13.0,10.0,,http://twitter.com/download/iphone,Twitter for iPhone,,3200890,10737,34222,https://pbs.twimg.com/ext_tw_video_thumb/887343120832229379/pu/img/6HSuFrW1lzI_9Mht.jpg,1,Mexican_hairless,0.330741,True,sea_lion,0.275645,False,Weimaraner,0.134203,True
887101392804085760,,,2017-07-18 00:07:08,This... is a Jubilant Antarctic House Bear. We only rate dogs. Please only send dogs. Thank you... 12/10 would suffocate in floof https://t.co/4Ad1jzJSdp,https://twitter.com/dog_rates/status/887101392804085760/photo/1,12.0,10.0,,http://twitter.com/download/iphone,Twitter for iPhone,,3200890,6167,31061,https://pbs.twimg.com/media/DE-eAq6UwAA-jaE.jpg,1,Samoyed,0.733942,True,Eskimo_dog,0.0350295,True,Staffordshire_bullterrier,0.0297047,True
886983233522544640,,,2017-07-17 16:17:36,This is Maya. She's very shy. Rarely leaves her cup. 13/10 would find her an environment to thrive in https://t.co/I6oNy0CgiT,https://twitter.com/dog_rates/status/886983233522544640/photo/1,13.0,10.0,Maya,http://twitter.com/download/iphone,Twitter for iPhone,,3200890,8084,35859,https://pbs.twimg.com/media/DE8yicJW0AAAvBJ.jpg,2,Chihuahua,0.793469,True,toy_terrier,0.143528,True,can_opener,0.0322529,False
886736880519319552,,,2017-07-16 23:58:41,"This is Mingus. He's a wonderful father to his smol pup. Confirmed 13/10, but he needs your help

https://t.co/bVi0Yr4Cff https://t.co/ISvKOSkd5b",https://twitter.com/dog_rates/status/886736880519319552/photo/1,13.0,10.0,Mingus,http://twitter.com/download/iphone,Twitter for iPhone,,3200890,3443,12306,https://pbs.twimg.com/media/DE5Se8FXcAAJFx4.jpg,1,kuvasz,0.309706,True,Great_Pyrenees,0.186136,True,Dandie_Dinmont,0.0863463,True
886680336477933568,,,2017-07-16 20:14:00,This is Derek. He's late for a dog meeting. 13/10 pet...al to the metal https://t.co/BCoWue0abA,https://twitter.com/dog_rates/status/886680336477933568/photo/1,13.0,10.0,Derek,http://twitter.com/download/iphone,Twitter for iPhone,,3200890,4610,22798,https://pbs.twimg.com/media/DE4fEDzWAAAyHMM.jpg,1,convertible,0.738995,False,sports_car,0.139952,False,car_wheel,0.0441726999999999,False
886366144734445568,,,2017-07-15 23:25:31,This is Roscoe. Another pupper fallen victim to spontaneous tongue ejections. Get the BlepiPen immediate. 12/10 deep breaths Roscoe https://t.co/RGE08MIJox,https://twitter.com/dog_rates/status/886366144734445568/photo/1,12.0,10.0,Roscoe,http://twitter.com/download/iphone,Twitter for iPhone,pupper,3200890,3316,21524,https://pbs.twimg.com/media/DE0BTnQUwAApKEH.jpg,1,French_bulldog,0.999201,True,Chihuahua,0.000361178,True,Boston_bull,7.55616e-05,True
885984800019947520,,,2017-07-14 22:10:11,Viewer discretion advised. This is Jimbo. He will rip ur finger right h*ckin off. Other dog clearly an accessory. 12/10 pls pet with caution https://t.co/BuveP0uMF1,https://twitter.com/dog_rates/status/885984800019947520/photo/1,12.0,10.0,Jimbo,http://twitter.com/download/iphone,Twitter for iPhone,,3200890,7097,33382,https://pbs.twimg.com/media/DEumeWWV0AA-Z61.jpg,1,Blenheim_spaniel,0.972494,True,Shih-Tzu,0.00663012,True,Bernese_mountain_dog,0.00623915,True
885528943205470208,,,2017-07-13 15:58:47,This is Maisey. She fell asleep mid-excavation. Happens to the best of us. 13/10 would pat noggin approvingly https://t.co/tp1kQ8i9JF,https://twitter.com/dog_rates/status/885528943205470208/photo/1,13.0,10.0,Maisey,http://twitter.com/download/iphone,Twitter for iPhone,,3200890,6683,36689,https://pbs.twimg.com/media/DEoH3yvXgAAzQtS.jpg,1,pug,0.369275,True,Labrador_retriever,0.265835,True,kuvasz,0.134697,True
885167619883638784,,,2017-07-12 16:03:00,Here we have a corgi undercover as a malamute. Pawbably doing important investigative work. Zero control over tongue happenings. 13/10 https://t.co/44ItaMubBf,https://twitter.com/dog_rates/status/885167619883638784/photo/1,13.0,10.0,,http://twitter.com/download/iphone,Twitter for iPhone,,3200890,4556,22367,https://pbs.twimg.com/media/DEi_N9qXYAAgEEw.jpg,4,malamute,0.8124819999999999,True,Siberian_husky,0.0717125,True,Eskimo_dog,0.0557697,True
884562892145688576,,,2017-07-11 00:00:02,This is Kevin. He's just so happy. 13/10 what is your secret Kevin https://t.co/1r4MFCbCX5,https://twitter.com/dog_rates/status/884562892145688576/photo/1,13.0,10.0,Kevin,http://twitter.com/download/iphone,Twitter for iPhone,,3200890,5100,24765,https://pbs.twimg.com/media/DEaZQkfXUAEC7qB.jpg,1,pug,0.5464060000000001,True,French_bulldog,0.404291,True,Brabancon_griffon,0.0440019,True
884441805382717440,,,2017-07-10 15:58:53,"I present to you, Pup in Hat. Pup in Hat is great for all occasions. Extremely versatile. Compact as h*ck. 14/10 (IG: itselizabethgales) https://t.co/vvBOcC2VdC",https://twitter.com/dog_rates/status/884441805382717440/photo/1,14.0,10.0,,http://twitter.com/download/iphone,Twitter for iPhone,,3200890,5856,27478,https://pbs.twimg.com/media/DEYrIZwWsAA2Wo5.jpg,1,Pembroke,0.993225,True,Cardigan,0.00321648,True,Chihuahua,0.00208089,True
883482846933004288,,,2017-07-08 00:28:19,"This is Bella. She hopes her smile made you smile. If not, she is also offering you her favorite monkey. 13.5/10 https://t.co/qjrljjt948",https://twitter.com/dog_rates/status/883482846933004288/photo/1,5.0,10.0,Bella,http://twitter.com/download/iphone,Twitter for iPhone,,3200890,10407,46860,https://pbs.twimg.com/media/DELC9dZXUAADqUk.jpg,1,golden_retriever,0.943082,True,Labrador_retriever,0.032409,True,kuvasz,0.00550072,True
883117836046086144,,,2017-07-07 00:17:54,"Please only send dogs. We don't rate mechanics, no matter how h*ckin good. Thank you... 13/10 would sneak a pat https://t.co/Se5fZ9wp5E",https://twitter.com/dog_rates/status/883117836046086144/photo/1,13.0,10.0,,http://twitter.com/download/iphone,Twitter for iPhone,,3200890,6949,37914,https://pbs.twimg.com/media/DEF2-_hXoAAs62q.jpg,2,golden_retriever,0.949562,True,Labrador_retriever,0.0459479,True,kuvasz,0.00247094,True
882992080364220416,,,2017-07-06 15:58:11,This is Rusty. He wasn't ready for the first pic. Clearly puppared for the second. 13/10 confirmed great boy https://t.co/tyER0KpdXj,https://twitter.com/dog_rates/status/882992080364220416/photo/1,13.0,10.0,Rusty,http://twitter.com/download/iphone,Twitter for iPhone,,3200890,4122,24445,https://pbs.twimg.com/media/DEEEnIqXYAAiJh_.jpg,1,Eskimo_dog,0.4667779999999999,True,Siberian_husky,0.406044,True,dingo,0.0734143999999999,False
882762694511734784,,,2017-07-06 00:46:41,This is Gus. He's quite the cheeky pupper. Already perfected the disinterested wink. 12/10 would let steal my girl https://t.co/D43I96SlVu,https://twitter.com/dog_rates/status/882762694511734784/photo/1,12.0,10.0,Gus,http://twitter.com/download/iphone,Twitter for iPhone,pupper,3200890,5134,28903,https://pbs.twimg.com/media/DEAz_HHXsAA-p_z.jpg,1,Labrador_retriever,0.85005,True,Chesapeake_Bay_retriever,0.074257,True,flat-coated_retriever,0.0155793999999999,True
882627270321602560,,,2017-07-05 15:48:34,This is Stanley. He has his first swim lesson today. Doggle straps adjusted. Ready to go. 13/10 Phelps is nervous (IG: stanleythe_corgi) https://t.co/Nx52PGwH94,https://twitter.com/dog_rates/status/882627270321602560/photo/1,13.0,10.0,Stanley,http://twitter.com/download/iphone,Twitter for iPhone,,3200890,6342,28382,https://pbs.twimg.com/media/DD-40X3WAAAJPU5.jpg,1,Pembroke,0.542982,True,Chihuahua,0.251988,True,Cardigan,0.107699,True
882268110199369728,,,2017-07-04 16:01:23,This is Alfy. You're witnessing his first watermelon experience. I think it was a success. 13/10 happy 4th Alfy ðŸ‡ºðŸ‡¸ https://t.co/fYP5RlutfA,https://twitter.com/dog_rates/status/882268110199369728/photo/1,13.0,10.0,Alfy,http://twitter.com/download/iphone,Twitter for iPhone,,3200890,12118,45880,https://pbs.twimg.com/media/DD5yKdPW0AArzX8.jpg,1,golden_retriever,0.762211,True,Labrador_retriever,0.0989848999999999,True,cocker_spaniel,0.0171995,True
881666595344535552,,,2017-07-03 00:11:11,This is Gary. He couldn't miss this puppertunity for a selfie. Flawless focusing skills. 13/10 would boop intensely https://t.co/7CSWCl8I6s,https://twitter.com/dog_rates/status/881666595344535552/photo/1,13.0,10.0,Gary,http://twitter.com/download/iphone,Twitter for iPhone,,3200890,11099,51522,https://pbs.twimg.com/media/DDxPFwbWAAEbVVR.jpg,1,Saluki,0.529012,True,Afghan_hound,0.250003,True,golden_retriever,0.160739,True
881268444196462592,,,2017-07-01 21:49:04,Meet Elliot. He's a Canadian Forrest Pup. Unusual number of antlers for a dog. Sneaky tongue slip to celebrate #Canada150. 12/10 would pet https://t.co/cgwJwowTMC,https://twitter.com/dog_rates/status/881268444196462592/photo/1,12.0,10.0,Elliot,http://twitter.com/download/iphone,Twitter for iPhone,,3200890,5358,23501,https://pbs.twimg.com/media/DDrk-f9WAAI-WQv.jpg,1,tusker,0.473303,False,Indian_elephant,0.245646,False,ibex,0.0556607,False
880872448815771648,,,2017-06-30 19:35:32,Ugh not again. We only rate dogs. Please don't send in well-dressed  floppy-tongued street penguins. Dogs only please. Thank you... 12/10 https://t.co/WiAMbTkDPf,https://twitter.com/dog_rates/status/880872448815771648/photo/1,12.0,10.0,,http://twitter.com/download/iphone,Twitter for iPhone,,3200890,3989,21734,https://pbs.twimg.com/media/DDl8zzJW0AAisCJ.jpg,1,Pembroke,0.791416,True,Norwich_terrier,0.0613929,True,Chihuahua,0.0337257,True
880465832366813184,,,2017-06-29 16:39:47,This is Bella. She had her first beach experience this morning. Complete success. 12/10 would perform a sandy boop https://t.co/4VsFysDmiw,https://twitter.com/dog_rates/status/880465832366813184/photo/1,12.0,10.0,Bella,http://twitter.com/download/iphone,Twitter for iPhone,,3200890,6546,29075,https://pbs.twimg.com/media/DDgK-J4XUAIEV9W.jpg,1,golden_retriever,0.913255,True,Labrador_retriever,0.0263286,True,cocker_spaniel,0.00937082,True
880221127280381952,,,2017-06-29 00:27:25,Meet Jesse. He's a Fetty Woof. His tongue ejects without warning. A true bleptomaniac. 12/10 would snug well https://t.co/fUod0tVmvK,https://twitter.com/dog_rates/status/880221127280381952/photo/1,12.0,10.0,Jesse,http://twitter.com/download/iphone,Twitter for iPhone,,3200890,4436,27640,https://pbs.twimg.com/media/DDcscbXU0AIfDzs.jpg,1,Chihuahua,0.238525,True,meerkat,0.104256,False,clumber,0.0525802999999999,True
879862464715927552,,,2017-06-28 00:42:13,This is Romeo. He would like to do an entrance. Requesting your immediate assistance. 13/10 https://t.co/Qh5aEkRQm9,https://twitter.com/dog_rates/status/879862464715927552/photo/1,13.0,10.0,Romeo,http://twitter.com/download/iphone,Twitter for iPhone,,3200890,3642,22667,https://pbs.twimg.com/media/DDXmPrbWAAEKMvy.jpg,3,basset,0.813507,True,beagle,0.146654,True,cocker_spaniel,0.00948502,True
879492040517615616,,,2017-06-27 00:10:17,This is Bailey. He thinks you should measure ear length for signs of growth instead. 12/10 https://t.co/IxM9IMKQq8,https://twitter.com/dog_rates/status/879492040517615616/photo/1,12.0,10.0,Bailey,http://twitter.com/download/iphone,Twitter for iPhone,,3200890,3323,23822,https://pbs.twimg.com/media/DDSVWMvXsAEgmMK.jpg,1,German_short-haired_pointer,0.479896,True,vizsla,0.1243529999999999,True,bath_towel,0.0733202,False
879376492567855104,,,2017-06-26 16:31:08,This is Jack AKA Stephen Furry. You're not scoring on him. Unless he slips down the slide. 12/10 would happily get blocked by https://t.co/0gOi601EAa,https://twitter.com/dog_rates/status/879376492567855104/photo/1,12.0,10.0,Jack,http://twitter.com/download/iphone,Twitter for iPhone,,3200891,3261,17099,https://pbs.twimg.com/media/DDQsQGFV0AAw6u9.jpg,1,tricycle,0.663601,False,Labrador_retriever,0.0334961,True,Pembroke,0.0188266,True
879050749262655488,,,2017-06-25 18:56:45,This is Steven. He has trouble relating to other dogs. Quite shy. Neck longer than average. Tropical probably. 11/10 would still pet https://t.co/2mJCDEJWdD,https://twitter.com/dog_rates/status/879050749262655488/photo/1,11.0,10.0,Steven,http://twitter.com/download/iphone,Twitter for iPhone,,3200892,4941,23022,https://pbs.twimg.com/media/DDMD_phXoAQ1qf0.jpg,1,tabby,0.311861,False,window_screen,0.169123,False,Egyptian_cat,0.132932,False
878281511006478336,,,2017-06-23 16:00:04,"Meet Shadow. In an attempt to reach maximum zooming borkdrive, he tore his ACL. Still 13/10 tho. Help him out below

https://t.co/245xJJElsY https://t.co/lUiQH219v6",https://twitter.com/dog_rates/status/878281511006478336/photo/1,13.0,10.0,Shadow,http://twitter.com/download/iphone,Twitter for iPhone,,3200892,1349,7913,https://pbs.twimg.com/media/DDBIX9QVYAAohGa.jpg,1,basset,0.32042,True,collie,0.215975,True,Appenzeller,0.1285069999999999,True
878057613040115712,,,2017-06-23 01:10:23,This is Emmy. She was adopted today. Massive round of pupplause for Emmy and her new family. 14/10 for all involved https://t.co/cwtWnHMVpe,https://twitter.com/dog_rates/status/878057613040115712/photo/1,14.0,10.0,Emmy,http://twitter.com/download/iphone,Twitter for iPhone,,3200892,7181,42876,https://pbs.twimg.com/media/DC98vABUIAA97pz.jpg,1,French_bulldog,0.839097,True,Boston_bull,0.0787993999999999,True,toy_terrier,0.0152433999999999,True
877736472329191424,,,2017-06-22 03:54:17,This is Aja. She was just told she's a good dog. Suspicions confirmed. 13/10 would tell again https://t.co/lsPyyAiF1r,https://twitter.com/dog_rates/status/877736472329191424/photo/1,13.0,10.0,Aja,http://twitter.com/download/iphone,Twitter for iPhone,,3200892,17300,71144,https://pbs.twimg.com/media/DC5YqoQW0AArOLH.jpg,2,Chesapeake_Bay_retriever,0.8379559999999999,True,Labrador_retriever,0.0620342,True,Weimaraner,0.0405991,True
877556246731214848,,,2017-06-21 15:58:08,This is Penny. She's both pupset and fired pup. Not pleased w your barbaric attempts at cleanliness. 12/10 would enjoy more shampoo options https://t.co/OYdDlfOGXP,https://twitter.com/dog_rates/status/877556246731214848/photo/1,12.0,10.0,Penny,http://twitter.com/download/iphone,Twitter for iPhone,,3200892,3994,23258,https://pbs.twimg.com/media/DC20wEcW0AAf59m.jpg,1,basset,0.995368,True,Welsh_springer_spaniel,0.00193621,True,bathtub,0.000467919,False
877201837425926144,,,2017-06-20 16:29:50,This is Nelly. He graduated with his dogtorate today. Wants to know if you're proud of him. 12/10 would give congratulatory boop https://t.co/4g4cfj3P4Y,https://twitter.com/dog_rates/status/877201837425926144/photo/1,12.0,10.0,Nelly,http://twitter.com/download/iphone,Twitter for iPhone,,3200892,5880,27755,https://pbs.twimg.com/media/DCxyahJWsAAddSC.jpg,1,Pembroke,0.93112,True,Cardigan,0.0686982,True,basenji,8.17379e-05,True
876838120628539392,,,2017-06-19 16:24:33,This is Ginger. She's having a ruff Monday. Too many pupper things going on. H*ckin exhausting. 12/10 would snug passionately https://t.co/j211oCDRs6,https://twitter.com/dog_rates/status/876838120628539392/photo/1,12.0,10.0,Ginger,http://twitter.com/download/iphone,Twitter for iPhone,pupper,3200892,3506,21125,https://pbs.twimg.com/media/DCsnnZsVwAEfkyi.jpg,1,bloodhound,0.575751,True,redbone,0.24097,True,Tibetan_mastiff,0.0889348,True
876484053909872640,,,2017-06-18 16:57:37,This is Benedict. He wants to thank you for this delightful urban walk. Hopes you know he loves you. 13/10 super duper good boy https://t.co/26BXueUgbs,https://twitter.com/dog_rates/status/876484053909872640/photo/1,13.0,10.0,Benedict,http://twitter.com/download/iphone,Twitter for iPhone,,3200891,2511,19163,https://pbs.twimg.com/media/DCnll_dUQAAkBdG.jpg,1,golden_retriever,0.874566,True,Irish_terrier,0.0373542,True,chow,0.0167235999999999,True
876120275196170240,,,2017-06-17 16:52:05,"Meet Venti, a seemingly caffeinated puppoccino. She was just informed the weekend would include walks, pats and scritches. 13/10 much excite https://t.co/ejExJFq3ek",https://twitter.com/dog_rates/status/876120275196170240/photo/1,13.0,10.0,Venti,http://twitter.com/download/iphone,Twitter for iPhone,,3200891,4903,28490,https://pbs.twimg.com/media/DCiavj_UwAAcXep.jpg,1,Bernese_mountain_dog,0.534327,True,Saint_Bernard,0.346312,True,Greater_Swiss_Mountain_dog,0.0949327,True
875747767867523072,,,2017-06-16 16:11:53,"This is Goose. He's a womanizer. Cheeky as h*ck, but also deep. Tongue slip game on another level. 13/10 will steal your girl https://t.co/V2WlACRJCN",https://twitter.com/dog_rates/status/875747767867523072/photo/1,13.0,10.0,Goose,http://twitter.com/download/iphone,Twitter for iPhone,,3200891,4497,25773,https://pbs.twimg.com/media/DCdH8YpUQAAiEbL.jpg,1,Labrador_retriever,0.799551,True,Chesapeake_Bay_retriever,0.179975,True,vizsla,0.0046176,True
875144289856114688,,,2017-06-15 00:13:52,Meet Nugget and Hank. Nugget took Hank's bone. Hank is wondering if you would please return it to him. Both 13/10 would not intervene https://t.co/ogith9ejNj,https://twitter.com/dog_rates/status/875144289856114688/video/1,13.0,10.0,Nugget,http://twitter.com/download/iphone,Twitter for iPhone,,3200891,5081,22185,https://pbs.twimg.com/ext_tw_video_thumb/875144175078957056/pu/img/BRi_l7vUdpb93Knf.jpg,1,Siberian_husky,0.245048,True,Pembroke,0.223716,True,dingo,0.160753,False
875021211251597312,,,2017-06-14 16:04:48,Guys please stop sending pictures without any dogs in th- oh never mind hello excuse me sir. 12/10 stealthy as h*ck https://t.co/brCQoqc8AW,https://twitter.com/dog_rates/status/875021211251597312/photo/1,12.0,10.0,,http://twitter.com/download/iphone,Twitter for iPhone,,3200891,4922,26022,https://pbs.twimg.com/media/DCSzF3NVoAAPzT4.jpg,2,West_Highland_white_terrier,0.7143189999999999,True,Siberian_husky,0.0919133,True,Great_Pyrenees,0.0460381999999999,True
874680097055178752,,,2017-06-13 17:29:20,Meet Cash. He hath acquired a stick. A very good stick tbh. 12/10 would pat head approvingly https://t.co/lZhtizkURD,https://twitter.com/dog_rates/status/874680097055178752/photo/1,12.0,10.0,Cash,http://twitter.com/download/iphone,Twitter for iPhone,,3200891,4875,28439,https://pbs.twimg.com/media/DCN85nGUwAAzG_q.jpg,1,Labrador_retriever,0.836052,True,Staffordshire_bullterrier,0.0470690999999999,True,beagle,0.0360071,True
874296783580663808,,,2017-06-12 16:06:11,This is Jed. He may be the fanciest pupper in the game right now. Knows it too. 13/10 would sign modeling contract https://t.co/0YplNnSMEm,https://twitter.com/dog_rates/status/874296783580663808/photo/1,13.0,10.0,Jed,http://twitter.com/download/iphone,Twitter for iPhone,pupper,3200891,4308,26651,https://pbs.twimg.com/media/DCIgSR0XgAANEOY.jpg,1,cocker_spaniel,0.437216,True,miniature_poodle,0.2771909999999999,True,toy_poodle,0.157402,True
