,tweet_id,in_reply_to_status_id,in_reply_to_user_id,timestamp,text,expanded_urls,rating_numerator,rating_denominator,name,user_followers,retweet,favorite,source_link,source_text,dog_etape
1544,675531475945709568,,,2015-12-12 04:23:49,This is Ellie AKA Queen Slayer of the Orbs. Very self-motivated. Great yard. Rad foliage. 10/10 would pet diligently https://t.co/c9jmg3Xtzn,https://twitter.com/dog_rates/status/675531475945709568/photo/1,10,10,Ellie,114031,428,1276,http://twitter.com/download/iphone,Twitter for iPhone,
1545,675522403582218240,,,2015-12-12 03:47:46,Meet Sammy. He's a Motorola Firefox. Hat under hoodie (must be a half-decent up and coming white rapper) 10/10 https://t.co/rO2zxf0OQ0,https://twitter.com/dog_rates/status/675522403582218240/photo/1,10,10,Sammy,114031,316,1122,http://twitter.com/download/iphone,Twitter for iPhone,
1546,675517828909424640,,,2015-12-12 03:29:35,12/10 stay woke https://t.co/XDiQw4Akiw,https://twitter.com/dog_rates/status/675517828909424640/photo/1,12,10,,114031,507,1414,http://twitter.com/download/iphone,Twitter for iPhone,
1547,675501075957489664,,,2015-12-12 02:23:01,"I shall call him squishy and he shall be mine, and he shall be my squishy. 13/10 https://t.co/WId5lxNdPH",https://twitter.com/dog_rates/status/675501075957489664/photo/1,13,10,,114031,6485,18482,http://twitter.com/download/iphone,Twitter for iPhone,
1548,675497103322386432,,,2015-12-12 02:07:14,Meet Reggie. He's going for the world record. Must concentrate. Focus up pup. 11/10 we all believe in you Reggie https://t.co/h3AWz4AzuC,https://twitter.com/dog_rates/status/675497103322386432/photo/1,11,10,Reggie,114031,1443,3397,http://twitter.com/download/iphone,Twitter for iPhone,
1549,675489971617296384,,,2015-12-12 01:38:53,RT until we find this dog. Clearly a cool dog (front leg relaxed out window). Looks to be a superb driver. 10/10 https://t.co/MnTrKaQ8Wn,https://twitter.com/dog_rates/status/675489971617296384/photo/1,10,10,,114031,672,1406,http://twitter.com/download/iphone,Twitter for iPhone,
1550,675483430902214656,,,2015-12-12 01:12:54,Rare shielded battle dog here. Very happy about abundance of lettuce. Painfully slow fetcher. Still petable. 5/10 https://t.co/C3tlKVq7eO,https://twitter.com/dog_rates/status/675483430902214656/photo/1,5,10,,114031,1081,1985,http://twitter.com/download/iphone,Twitter for iPhone,
1551,675432746517426176,,,2015-12-11 21:51:30,Happy Friday. Here's some golden puppers. 12/10 for all https://t.co/wNkqAED6lG,https://twitter.com/dog_rates/status/675432746517426176/photo/1,12,10,,114031,627,1623,http://twitter.com/download/iphone,Twitter for iPhone,
1552,675372240448454658,,,2015-12-11 17:51:04,"The tail alone is 13/10. Great dog, better owner https://t.co/IyAXinfyju",https://twitter.com/dog_rates/status/675372240448454658/photo/1,13,10,,114031,563,1838,http://twitter.com/download/iphone,Twitter for iPhone,
1553,675362609739206656,,,2015-12-11 17:12:48,This is Daisy. She loves that shoe. Still no seat belt. Super churlish. 12/10 the dogs are killing it today https://t.co/cZlkvgRPdn,https://twitter.com/dog_rates/status/675362609739206656/photo/1,12,10,Daisy,114031,262,1136,http://twitter.com/download/iphone,Twitter for iPhone,
1554,675354435921575936,,,2015-12-11 16:40:19,Everyone needs to watch this. 13/10 https://t.co/Bb3xnpsWBC,https://twitter.com/dog_rates/status/675354435921575936/video/1,13,10,,114031,18963,35178,http://twitter.com,Twitter Web Client,
1555,675349384339542016,6.749998076819087e+17,4196983835.0,2015-12-11 16:20:15,Yea I lied. Here's more. All 13/10 https://t.co/ZQZf2U4xCP,https://twitter.com/dog_rates/status/675349384339542016/photo/1,13,10,,114031,2532,4237,http://twitter.com/download/iphone,Twitter for iPhone,
1556,675334060156301312,,,2015-12-11 15:19:21,Good morning here's a grass pupper. 12/10 https://t.co/2d68FmWGGs,https://twitter.com/dog_rates/status/675334060156301312/photo/1,12,10,,114031,1436,3007,http://twitter.com/download/iphone,Twitter for iPhone,pupper
1557,675166823650848770,,,2015-12-11 04:14:49,This is Arnold. He broke his leg saving a handicapped child from a forest fire. True hero. 10/10 inspirational dog https://t.co/bijCeHeX4C,https://twitter.com/dog_rates/status/675166823650848770/photo/1,10,10,Arnold,114031,1795,3920,http://twitter.com/download/iphone,Twitter for iPhone,
1558,675153376133427200,,,2015-12-11 03:21:23,What kind of person sends in a picture without a dog in it? 1/10 just because that's a nice table https://t.co/RDXCfk8hK0,https://twitter.com/dog_rates/status/675153376133427200/photo/1,1,10,,114031,2734,6072,http://twitter.com/download/iphone,Twitter for iPhone,
1559,675149409102012420,,,2015-12-11 03:05:37,holy shit 12/10 https://t.co/p6O8X93bTQ,https://twitter.com/dog_rates/status/675149409102012420/photo/1,12,10,,114031,1878,4037,http://twitter.com/download/iphone,Twitter for iPhone,
1560,675147105808306176,,,2015-12-11 02:56:28,When you're presenting a group project and the 4th guy tells the teacher that he did all the work. 10/10 https://t.co/f50mbB4UWS,https://twitter.com/dog_rates/status/675147105808306176/photo/1,10,10,,114031,273,1026,http://twitter.com/download/iphone,Twitter for iPhone,
1561,675146535592706048,,,2015-12-11 02:54:12,This is Coops. He's yelling at the carpet. Not very productive Coops. 7/10 https://t.co/Uz52oYnHzF,https://twitter.com/dog_rates/status/675146535592706048/photo/1,7,10,Coops,114031,349,1300,http://twitter.com/download/iphone,Twitter for iPhone,
1562,675145476954566656,,,2015-12-11 02:49:59,What an honor. 3 dogs here. Blond one is clearly a gymnast. Other two just confused. Very nifty pups. 9/10 for all https://t.co/YDgstgIDGs,https://twitter.com/dog_rates/status/675145476954566656/photo/1,9,10,,114031,1011,2305,http://twitter.com/download/iphone,Twitter for iPhone,
1563,675135153782571009,,,2015-12-11 02:08:58,This is Steven. He got locked outside. Damn it Steven. 5/10 nice grill tho https://t.co/zf7Sxxjfp3,https://twitter.com/dog_rates/status/675135153782571009/photo/1,5,10,Steven,114031,542,1398,http://twitter.com/download/iphone,Twitter for iPhone,
1564,675113801096802304,,,2015-12-11 00:44:07,Meet Zuzu. He just graduated college. Astute pupper. Needs 2 leashes to contain him. Wasn't ready for the pic. 10/10 https://t.co/2H5SKmk0k7,https://twitter.com/dog_rates/status/675113801096802304/photo/1,10,10,Zuzu,114031,877,2120,http://twitter.com/download/iphone,Twitter for iPhone,pupper
1565,675111688094527488,,,2015-12-11 00:35:44,Say hello to Oliver. He thought what was inside the pillow should be outside the pillow. Blurry since birth. 8/10 https://t.co/lFU9W31Fg9,https://twitter.com/dog_rates/status/675111688094527488/photo/1,8,10,Oliver,114031,283,1042,http://twitter.com/download/iphone,Twitter for iPhone,
1566,675109292475830276,,,2015-12-11 00:26:12,C'mon guys. We've been over this. We only rate dogs. This is a cow. Please only submit dogs. Thank you...... 9/10 https://t.co/WjcELNEqN2,https://twitter.com/dog_rates/status/675109292475830276/photo/1,9,10,a,114031,1259,3006,http://twitter.com/download/iphone,Twitter for iPhone,
1567,675047298674663426,,,2015-12-10 20:19:52,This is a fluffy albino Bacardi Columbia mix. Excellent at the tweets. 11/10 would hug gently https://t.co/diboDRUuEI,https://twitter.com/dog_rates/status/675047298674663426/photo/1,11,10,a,114031,366,1141,http://twitter.com/download/iphone,Twitter for iPhone,
1568,675015141583413248,,,2015-12-10 18:12:05,Meet Moe. He's a golden Fetty Woof. Doesn't respect the authorities. Might own a motorhome? 10/10 revolutionary pup https://t.co/JAncIdNp8G,https://twitter.com/dog_rates/status/675015141583413248/photo/1,10,10,Moe,114031,1335,2918,http://twitter.com/download/iphone,Twitter for iPhone,
1569,675006312288268288,,,2015-12-10 17:37:00,Say hello to Mollie. This pic was taken after she bet all her toys on Ronda Rousey. 10/10 hang in there pupper https://t.co/QMmAqA9VqO,https://twitter.com/dog_rates/status/675006312288268288/photo/1,10,10,Mollie,114031,252,1057,http://twitter.com/download/iphone,Twitter for iPhone,pupper
1570,675003128568291329,,,2015-12-10 17:24:21,Meet Laela. She's adorable. Magnificent eyes. But I don't see a seat belt. Insubordinate.. and churlish. Still 12/10 https://t.co/pCGDgLkLo6,https://twitter.com/dog_rates/status/675003128568291329/photo/1,12,10,Laela,114031,517,1672,http://twitter.com/download/iphone,Twitter for iPhone,
1571,674999807681908736,6.747933991411466e+17,4196983835.0,2015-12-10 17:11:09,Ok last one of these. I may try to make some myself. Anyway here ya go. 13/10 https://t.co/i9CDd1oEu8,https://twitter.com/dog_rates/status/674999807681908736/photo/1,13,10,,114031,1232,2433,http://twitter.com/download/iphone,Twitter for iPhone,
1572,674805413498527744,,,2015-12-10 04:18:42,"When your entire life is crumbling before you and you're trying really hard to hold your shit together.
10/10 https://t.co/vqFkgYPCW8",https://twitter.com/dog_rates/status/674805413498527744/video/1,10,10,,114031,391,934,http://twitter.com/download/iphone,Twitter for iPhone,
1573,674800520222154752,,,2015-12-10 03:59:15,This is Tedders. He broke his leg saving babies from the Pompeii eruption. 11/10 where's his Purple Heart? @POTUS https://t.co/cMI2AcLm4B,https://twitter.com/dog_rates/status/674800520222154752/photo/1,11,10,Tedders,114031,949,3240,http://twitter.com/download/iphone,Twitter for iPhone,
1574,674793399141146624,6.717299066283418e+17,4196983835.0,2015-12-10 03:30:58,I have found another. 13/10 https://t.co/HwroPYv8pY,https://twitter.com/dog_rates/status/674793399141146624/photo/1,13,10,,114031,1225,2697,http://twitter.com/download/iphone,Twitter for iPhone,
1575,674790488185167872,,,2015-12-10 03:19:24,ER... MER... GERD 13/10 https://t.co/L1puJISV1a,https://twitter.com/dog_rates/status/674790488185167872/photo/1,13,10,,114031,278,1180,http://twitter.com/download/iphone,Twitter for iPhone,
1576,674788554665512960,,,2015-12-10 03:11:43,Say hello to Maggie. She's a Western Septic Downy. Pretends to be Mexican. Great hardwood flooring. 9/10 https://t.co/P3ElQ2wsjb,https://twitter.com/dog_rates/status/674788554665512960/photo/1,9,10,Maggie,114031,230,871,http://twitter.com/download/iphone,Twitter for iPhone,
1577,674781762103414784,,,2015-12-10 02:44:43,Bedazzled pup here. Fashionable af. Super yellow. Looks hella fluffy. Webbed paws for efficient fetching. 8/10 https://t.co/ot8yMUGodj,https://twitter.com/dog_rates/status/674781762103414784/photo/1,8,10,,114031,1335,2169,http://twitter.com/download/iphone,Twitter for iPhone,
1578,674774481756377088,,,2015-12-10 02:15:47,This is Superpup. His head isn't proportional to his body. Has yet to serve any justice. 11/10 maybe one day pupper https://t.co/gxIFgg8ktm,https://twitter.com/dog_rates/status/674774481756377088/photo/1,11,10,Superpup,114031,532,1213,http://twitter.com/download/iphone,Twitter for iPhone,pupper
1579,674767892831932416,,,2015-12-10 01:49:36,This pup was carefully tossed to make it look like she's riding that horse. I have no words this is fabulous. 12/10 https://t.co/Bob33W4sfD,https://twitter.com/dog_rates/status/674767892831932416/photo/1,12,10,,114031,883,1981,http://twitter.com/download/iphone,Twitter for iPhone,
1580,674764817387900928,,,2015-12-10 01:37:23,These two pups are masters of camouflage. Very dedicated to the craft. Both must've spent decades practicing. 10/10s https://t.co/RBiQ8hPqwr,https://twitter.com/dog_rates/status/674764817387900928/photo/1,10,10,,114031,263,852,http://twitter.com/download/iphone,Twitter for iPhone,
1581,674754018082705410,6.747522332008202e+17,4196983835.0,2015-12-10 00:54:28,Just received another perfect photo of dogs and the sunset. 12/10 https://t.co/9YmNcxA2Cc,https://twitter.com/dog_rates/status/674754018082705410/photo/1,12,10,,114031,488,1456,http://twitter.com/download/iphone,Twitter for iPhone,
1582,674752233200820224,,,2015-12-10 00:47:23,Everyone please just appreciate how perfect these two photos are. 12/10 for both https://t.co/rLf7asnHxO,https://twitter.com/dog_rates/status/674752233200820224/photo/1,12,10,,114031,516,1580,http://twitter.com/download/iphone,Twitter for iPhone,
1583,674743008475090944,,,2015-12-10 00:10:43,This is Sophie. She just saw a spider. 10/10 don't just stand there Sophie https://t.co/VagYftZccT,https://twitter.com/dog_rates/status/674743008475090944/photo/1,10,10,Sophie,114031,607,1514,http://twitter.com/download/iphone,Twitter for iPhone,
1584,674742531037511680,6.747399531344036e+17,4196983835.0,2015-12-10 00:08:50,Some clarification is required. The dog is singing Cher and that is more than worthy of an 11/10. Thank you,,11,10,,114031,55,527,http://twitter.com/download/iphone,Twitter for iPhone,
1585,674739953134403584,,,2015-12-09 23:58:35,"""ðŸŽ¶ DO YOU BELIEVE IN LIFE AFTER LOVE ðŸŽ¶""
11/10 https://t.co/URNs5zFskc",https://twitter.com/dog_rates/status/674739953134403584/photo/1,11,10,,114031,437,1194,http://twitter.com/download/iphone,Twitter for iPhone,
1586,674737130913071104,,,2015-12-09 23:47:22,Meet Rufio. He is unaware of the pink legless pupper wrapped around him. Might want to get that checked 10/10 &amp; 4/10 https://t.co/KNfLnYPmYh,https://twitter.com/dog_rates/status/674737130913071104/photo/1,10,10,Rufio,114031,103,693,http://twitter.com/download/iphone,Twitter for iPhone,pupper
1587,674690135443775488,,,2015-12-09 20:40:38,Meet Patrick. He's an exotic pup. Jumps great distances for a dog. Always gets injured when I toss him a ball. 3/10 https://t.co/Unz1uNrOzo,https://twitter.com/dog_rates/status/674690135443775488/photo/1,3,10,Patrick,114031,510,1237,http://twitter.com/download/iphone,Twitter for iPhone,
1588,674670581682434048,,,2015-12-09 19:22:56,Meet Jeb &amp; Bush. Jeb is somehow stuck in that fence and Bush won't stop whispering sweet nothings in his ear. 9/10s https://t.co/NRNExUy9Hm,https://twitter.com/dog_rates/status/674670581682434048/photo/1,9,10,Jeb,114031,729,1751,http://twitter.com/download/iphone,Twitter for iPhone,
1589,674664755118911488,,,2015-12-09 18:59:46,This is Rodman. He's getting destroyed by the surfs. Valiant effort though. 10/10 better than most puppers probably https://t.co/S8wCLemrNb,https://twitter.com/dog_rates/status/674664755118911488/photo/1,10,10,Rodman,114031,276,994,http://twitter.com/download/iphone,Twitter for iPhone,
1590,674646392044941312,,,2015-12-09 17:46:48,Two gorgeous dogs here. Little waddling dog is a rebel. Refuses to look at camera. Must be a preteen. 5/10 &amp; 8/10 https://t.co/YPfw7oahbD,https://twitter.com/dog_rates/status/674646392044941312/photo/1,5,10,,114031,557,1533,http://twitter.com/download/iphone,Twitter for iPhone,
1591,674644256330530816,,,2015-12-09 17:38:19,When you see sophomores in high school driving. 11/10 https://t.co/m6aC8d1Kzp,https://twitter.com/dog_rates/status/674644256330530816/photo/1,11,10,,114031,311,1111,http://twitter.com/download/iphone,Twitter for iPhone,
1592,674638615994089473,,,2015-12-09 17:15:54,This pupper is fed up with being tickled. 12/10 I'm currently working on an elaborate heist to steal this dog https://t.co/F33n1hy3LL,https://twitter.com/dog_rates/status/674638615994089473/photo/1,12,10,,114031,650,1806,http://twitter.com/download/iphone,Twitter for iPhone,pupper
1593,674632714662858753,,,2015-12-09 16:52:27,Rare submerged pup here. Holds breath for a long time. Frowning because that spoon ignores him. 5/10 would still pet https://t.co/EJzzNHE8bE,https://twitter.com/dog_rates/status/674632714662858753/photo/1,5,10,,114031,637,1617,http://twitter.com/download/iphone,Twitter for iPhone,
1594,674606911342424069,6.744688808997888e+17,4196983835.0,2015-12-09 15:09:55,The 13/10 also takes into account this impeccable yard. Louis is great but the future dad in me can't ignore that luscious green grass,,13,10,,114031,115,1013,http://twitter.com/download/iphone,Twitter for iPhone,
1595,674468880899788800,,,2015-12-09 06:01:26,This is Louis. He thinks he's flying. 13/10 this is a legendary pup https://t.co/6d9WziPXmx,https://twitter.com/dog_rates/status/674468880899788800/photo/1,13,10,Louis,114031,2275,6676,http://twitter.com/download/iphone,Twitter for iPhone,
1596,674447403907457024,,,2015-12-09 04:36:06,This pupper just wants a belly rub. This pupper has nothing to do w the tree being sideways now. 10/10 good pupper https://t.co/AyJ7Ohk71f,https://twitter.com/dog_rates/status/674447403907457024/photo/1,10,10,,114031,393,1137,http://twitter.com/download/iphone,Twitter for iPhone,pupper
1597,674436901579923456,,,2015-12-09 03:54:22,Meet Bailey. She plays with her food. Very childish. Doesn't even need a battle helmet smh. Still cute though. 9/10 https://t.co/CLEOjxhTEx,https://twitter.com/dog_rates/status/674436901579923456/photo/1,9,10,Bailey,114031,426,1198,http://twitter.com/download/iphone,Twitter for iPhone,
1598,674422304705744896,,,2015-12-09 02:56:22,This is Ava. She doesn't understand flowers. 12/10 would caress firmly https://t.co/BxTJAFSIgk,https://twitter.com/dog_rates/status/674422304705744896/photo/1,12,10,Ava,114031,592,1536,http://twitter.com/download/iphone,Twitter for iPhone,
1599,674416750885273600,,,2015-12-09 02:34:18,This is Jonah. He's a Stinted Fisher Price. Enjoys chewing on his miniature RipStik. 10/10 very upbeat fellow https://t.co/7qjXy1uUYY,https://twitter.com/dog_rates/status/674416750885273600/photo/1,10,10,Jonah,114031,157,731,http://twitter.com/download/iphone,Twitter for iPhone,
1600,674410619106390016,,,2015-12-09 02:09:56,This is Lenny. He wants to be a sprinkler. 10/10 you got this Lenny https://t.co/CZ0YaB40Hn,https://twitter.com/dog_rates/status/674410619106390016/photo/1,10,10,Lenny,114031,515,1289,http://twitter.com/download/iphone,Twitter for iPhone,
1601,674394782723014656,,,2015-12-09 01:07:00,This is Gary. He's a hide and seek champion. Second only to Kony. 8/10 Gary has a gift https://t.co/cAlB4XCcsi,https://twitter.com/dog_rates/status/674394782723014656/photo/1,8,10,Gary,114031,635,1607,http://twitter.com/download/iphone,Twitter for iPhone,
1602,674372068062928900,,,2015-12-08 23:36:44,Meet Chesney. On the outside he stays calm &amp; collected. On the inside he's having a complete mental breakdown. 10/10 https://t.co/G4m0TFY9uc,https://twitter.com/dog_rates/status/674372068062928900/photo/1,10,10,Chesney,114031,346,931,http://twitter.com/download/iphone,Twitter for iPhone,
1603,674330906434379776,6.658146967007232e+17,16374678.0,2015-12-08 20:53:11,"13/10
@ABC7",,13,10,,114031,83,602,http://twitter.com/download/iphone,Twitter for iPhone,
1604,674318007229923329,,,2015-12-08 20:01:55,This is Lennon. He's in quite the predicament. 8/10 hang in there pupper https://t.co/7mf8XXPAZv,https://twitter.com/dog_rates/status/674318007229923329/photo/1,8,10,Lennon,114031,570,1516,http://twitter.com/download/iphone,Twitter for iPhone,pupper
1605,674291837063053312,,,2015-12-08 18:17:56,This is Kenny. He just wants to be included in the happenings. 11/10 https://t.co/2S6oye3XqK,https://twitter.com/dog_rates/status/674291837063053312/photo/1,11,10,Kenny,114031,6533,15817,http://twitter.com/download/iphone,Twitter for iPhone,
1606,674271431610523648,,,2015-12-08 16:56:51,"""AT DAWN, WE RIDE""
10/10 for both dogs https://t.co/3aXX6wH6it",https://twitter.com/dog_rates/status/674271431610523648/photo/1,10,10,,114031,800,1682,http://twitter.com/download/iphone,Twitter for iPhone,
1607,674269164442398721,,,2015-12-08 16:47:50,"This is Bob. He's a Juniper Fitzsimmons. His body is 2, but his face is 85. Always looks miserable. Nice stool. 8/10 https://t.co/vYe9RlVz2N",https://twitter.com/dog_rates/status/674269164442398721/photo/1,8,10,Bob,114031,255,961,http://twitter.com/download/iphone,Twitter for iPhone,
1608,674265582246694913,,,2015-12-08 16:33:36,This is Henry. He's a shit dog. Short pointy ears. Leaves trail of pee. Not fluffy. Doesn't come when called. 2/10 https://t.co/Pu9RhfHDEQ,https://twitter.com/dog_rates/status/674265582246694913/photo/1,2,10,Henry,114031,936,1766,http://twitter.com/download/iphone,Twitter for iPhone,
1609,674262580978937856,,,2015-12-08 16:21:41,This is Gus. He's super stoked about being an elephant. Couldn't be happier. 9/10 for elephant pupper https://t.co/gJS1qU0jP7,https://twitter.com/dog_rates/status/674262580978937856/photo/1,9,10,Gus,114031,498,1391,http://twitter.com/download/iphone,Twitter for iPhone,pupper
1610,674255168825880576,,,2015-12-08 15:52:13,Say hello to Bobbay. He's a marshmallow wizard. 10/10 https://t.co/r6LZN1o1Gx,https://twitter.com/dog_rates/status/674255168825880576/photo/1,10,10,Bobbay,114031,619,1581,http://twitter.com/download/iphone,Twitter for iPhone,
1611,674082852460433408,,,2015-12-08 04:27:30,This is a Sagitariot Baklava mix. Loves her new hat. 11/10 radiant pup https://t.co/Bko5kFJYUU,https://twitter.com/dog_rates/status/674082852460433408/photo/1,11,10,a,114031,186,804,http://twitter.com/download/iphone,Twitter for iPhone,
1612,674075285688614912,,,2015-12-08 03:57:26,Say hello to Mitch. He thinks that's a hat. Nobody has told him yet. 11/10 please no one tell him https://t.co/7jOPktauh4,https://twitter.com/dog_rates/status/674075285688614912/photo/1,11,10,Mitch,114031,316,1047,http://twitter.com/download/iphone,Twitter for iPhone,
1613,674063288070742018,,,2015-12-08 03:09:46,This is Earl. Earl is lost. Someone help Earl. He has no tags. Just trying to get home. 5/10 hang in there Earl https://t.co/1ZbfqAVDg6,https://twitter.com/dog_rates/status/674063288070742018/photo/1,5,10,Earl,114031,2450,6769,http://twitter.com/download/iphone,Twitter for iPhone,
1614,674053186244734976,,,2015-12-08 02:29:37,"This is Stanley. Yes he is aware of the spoon's presence, he just doesn't know what he should do about it. 10/10 https://t.co/gQAMg5ypW5",https://twitter.com/dog_rates/status/674053186244734976/photo/1,10,10,Stanley,114031,1441,3576,http://twitter.com/download/iphone,Twitter for iPhone,
1615,674051556661161984,,,2015-12-08 02:23:09,This is Lucy. She knits. Specializes in toboggans. 10/10 I'd buy a toboggan from Lucy https://t.co/YE2XDHy4Yk,https://twitter.com/dog_rates/status/674051556661161984/photo/1,10,10,Lucy,114031,530,1564,http://twitter.com/download/iphone,Twitter for iPhone,
1616,674045139690631169,,,2015-12-08 01:57:39,Herd of wild dogs here. Not sure what they're trying to do. No real goals in life. 3/10 find your purpose puppers https://t.co/t5ih0VrK02,https://twitter.com/dog_rates/status/674045139690631169/photo/1,3,10,,114031,710,1520,http://twitter.com/download/iphone,Twitter for iPhone,
1617,674042553264685056,,,2015-12-08 01:47:22,Yea I can't handle the cuteness anymore. Curls for days. 12/10 for all https://t.co/sAI6gCGZYX,https://twitter.com/dog_rates/status/674042553264685056/photo/1,12,10,,114031,142,772,http://twitter.com/download/iphone,Twitter for iPhone,
1618,674038233588723717,,,2015-12-08 01:30:12,This is Kaiya. She's an aspiring shoe model. 12/10 follow your dreams pupper https://t.co/nX8FiGRHvk,https://twitter.com/dog_rates/status/674038233588723717/photo/1,12,10,Kaiya,114031,456,1176,http://twitter.com/download/iphone,Twitter for iPhone,pupper
1619,674036086168010753,,,2015-12-08 01:21:40,Meet Daisy. She has no eyes &amp; her face has been blurry since birth. Quite the trooper tho. Still havin a blast. 9/10 https://t.co/jcNdw43BIP,https://twitter.com/dog_rates/status/674036086168010753/photo/1,9,10,Daisy,114031,240,906,http://twitter.com/download/iphone,Twitter for iPhone,
1620,674024893172875264,,,2015-12-08 00:37:11,When you realize it doesn't matter how hard you study. You're still going to fail. 10/10 https://t.co/qzYXbyv0SJ,https://twitter.com/dog_rates/status/674024893172875264/photo/1,10,10,,114031,1360,1914,http://twitter.com/download/iphone,Twitter for iPhone,
1621,674019345211760640,,,2015-12-08 00:15:09,This is Acro. You briefly see her out of the corner of your eye. You look and she's not there. 10/10 mysterious pup https://t.co/fqiEsTduEs,https://twitter.com/dog_rates/status/674019345211760640/photo/1,10,10,Acro,114031,340,1208,http://twitter.com/download/iphone,Twitter for iPhone,
1622,674014384960745472,,,2015-12-07 23:55:26,Say hello to Aiden. His eyes are magical. Loves his little Guy Fieri friend. Sneaky tongue slip. 11/10 would caress https://t.co/Ac37LOe3xD,https://twitter.com/dog_rates/status/674014384960745472/photo/1,11,10,Aiden,114031,714,1676,http://twitter.com/download/iphone,Twitter for iPhone,
1623,674008982932058114,,,2015-12-07 23:33:58,This pup is sad bc he didn't get to be the toy car. Also he has shitty money management skills. 10/10 still cute tho https://t.co/PiSXXZjDSJ,https://twitter.com/dog_rates/status/674008982932058114/photo/1,10,10,,114031,393,1297,http://twitter.com/download/iphone,Twitter for iPhone,
1624,673956914389192708,,,2015-12-07 20:07:04,This is one esteemed pupper. Just graduated college. 10/10 what a champ https://t.co/nyReCVRiyd,https://twitter.com/dog_rates/status/673956914389192708/photo/1,10,10,one,114031,1069,2091,http://twitter.com/download/iphone,Twitter for iPhone,pupper
1625,673919437611909120,,,2015-12-07 17:38:09,This is Obie. He is on guard watching for evildoers from the comfort of his pumpkin. Very brave pupper. 11/10 https://t.co/cdwPTsGEAb,https://twitter.com/dog_rates/status/673919437611909120/photo/1,11,10,Obie,114031,401,1251,http://twitter.com/download/iphone,Twitter for iPhone,pupper
1626,673906403526995968,,,2015-12-07 16:46:21,Guys I'm getting real tired of this. We only rate dogs. Please don't send in other things like this Bulbasaur. 3/10 https://t.co/t5rQHl6W8M,https://twitter.com/dog_rates/status/673906403526995968/photo/1,3,10,,114031,1799,3406,http://twitter.com/download/iphone,Twitter for iPhone,
1627,673887867907739649,,,2015-12-07 15:32:42,When you're having a great time sleeping and your mom comes in and turns on the lights. 10/10 https://t.co/6qYd6BNSPd,https://twitter.com/dog_rates/status/673887867907739649/photo/1,10,10,,114031,274,994,http://twitter.com/download/iphone,Twitter for iPhone,
