,tweet_id,in_reply_to_status_id,in_reply_to_user_id,timestamp,text,expanded_urls,rating_numerator,rating_denominator,name,user_followers,retweet,favorite,source_link,source_text,dog_etape
472,795400264262053889,,,2016-11-06 22:59:35,This is Brody. He's trying to make the same face as the football. 12/10 https://t.co/2H4MfOGlpQ,https://twitter.com/dog_rates/status/795400264262053889/photo/1,12,10,Brody,114031,3323,11270,http://twitter.com/download/iphone,Twitter for iPhone,
473,795076730285391872,,,2016-11-06 01:33:58,This is Bailey. She loves going down slides but is very bad at it. Still 11/10 https://t.co/ivPWhspN3E,https://twitter.com/dog_rates/status/795076730285391872/photo/1,11,10,Bailey,114031,6288,18139,http://twitter.com/download/iphone,Twitter for iPhone,
474,794926597468000259,,,2016-11-05 15:37:24,This is Mack. He's rather h*ckin sleepy. Exceptional ears. 12/10 would boop https://t.co/XRPvTPF0VH,https://twitter.com/dog_rates/status/794926597468000259/photo/1,12,10,Mack,114031,2697,11492,http://twitter.com/download/iphone,Twitter for iPhone,
475,794332329137291264,,,2016-11-04 00:15:59,This is Nimbus (like the cloud). He just bought this fancy af duck raincoat. Only protects one ear tho. 12/10 so h*ckin floofy https://t.co/SIQbb8c3AU,https://twitter.com/dog_rates/status/794332329137291264/photo/1,12,10,Nimbus,114031,3088,10686,http://twitter.com/download/iphone,Twitter for iPhone,
476,794205286408003585,,,2016-11-03 15:51:10,This is Laika. She was a space pupper. The first space pupper actually. Orbited earth like a h*ckin boss. 14/10 hero af https://t.co/trSjgY3h4g,https://twitter.com/dog_rates/status/794205286408003585/photo/1,14,10,Laika,114031,3895,10314,http://twitter.com/download/iphone,Twitter for iPhone,pupper
477,793962221541933056,,,2016-11-02 23:45:19,This is Maximus. His face is stuck like that. Tragic really. Great tongue tho. 12/10 would pet firmly https://t.co/xIfrsMNLBR,https://twitter.com/dog_rates/status/793962221541933056/photo/1,12,10,Maximus,114031,5711,18910,http://twitter.com/download/iphone,Twitter for iPhone,
478,793845145112371200,,,2016-11-02 16:00:06,This is Clark. He was just caught wearing pants. 13/10 game-changing af https://t.co/2Xo19aPrG5,https://twitter.com/dog_rates/status/793845145112371200/photo/1,13,10,Clark,114031,2187,10295,http://twitter.com/download/iphone,Twitter for iPhone,
479,793601777308463104,,,2016-11-01 23:53:02,This is Dobby. I can't stop looking at her feet. 12/10 would absolutely snug https://t.co/LhzPWv6rTv,https://twitter.com/dog_rates/status/793601777308463104/photo/1,12,10,Dobby,114031,1908,8926,http://twitter.com/download/iphone,Twitter for iPhone,
480,793500921481273345,,,2016-11-01 17:12:16,This is Fiona. She's an extremely mediocre copilot. Very distracting. Wink makes up for all the missed turns. 12/10 https://t.co/aF5MmpvPqN,https://twitter.com/dog_rates/status/793500921481273345/photo/1,12,10,Fiona,114031,2786,11953,http://twitter.com/download/iphone,Twitter for iPhone,
481,793286476301799424,,,2016-11-01 03:00:09,This is Moreton. He's the Good Boy Who Lived. 13/10 magical as h*ck https://t.co/rLHGx3VAF3,https://twitter.com/dog_rates/status/793286476301799424/photo/1,13,10,Moreton,114031,10723,27597,http://twitter.com/download/iphone,Twitter for iPhone,
482,793271401113350145,,,2016-11-01 02:00:14,Meet Dave. It's his favorite day of the year. He gets to fulfill his dream of being a dinosaur. 12/10 inspirational af https://t.co/MgQSdfZGPN,https://twitter.com/dog_rates/status/793271401113350145/photo/1,12,10,Dave,114031,2763,9677,http://twitter.com/download/iphone,Twitter for iPhone,
483,793256262322548741,,,2016-11-01 01:00:05,Oh h*ck look at this spookling right here. Fright level off the charts. 12/10 sufficiently spooked https://t.co/BNy9IIJMb0,https://twitter.com/dog_rates/status/793256262322548741/photo/1,12,10,,114031,9714,22350,http://twitter.com/download/iphone,Twitter for iPhone,
484,793241302385262592,,,2016-11-01 00:00:38,This is Tucker. He's out here bustin h*ckin ghosts. 13/10 dedicated af https://t.co/Ap477GhwXt,https://twitter.com/dog_rates/status/793241302385262592/photo/1,13,10,Tucker,114031,3812,11780,http://twitter.com/download/iphone,Twitter for iPhone,
485,793226087023144960,,,2016-10-31 23:00:11,"This is Juno. She spooked me up real good, but only to get my attention. Above average handwriting for a dog I think. 11/10 https://t.co/hFxxBCWlwj",https://twitter.com/dog_rates/status/793226087023144960/photo/1,11,10,Juno,114031,3338,11001,http://twitter.com/download/iphone,Twitter for iPhone,
486,793210959003287553,,,2016-10-31 22:00:04,This is Maude. She's the h*ckin happiest wasp you've ever seen. 10/10 would pet with caution https://t.co/etL8FHBrh8,https://twitter.com/dog_rates/status/793210959003287553/photo/1,10,10,Maude,114031,3301,9997,http://twitter.com/download/iphone,Twitter for iPhone,
487,793195938047070209,,,2016-10-31 21:00:23,Say hello to Lily. She's pupset that her costume doesn't fit as well as last year. 12/10 poor puppo https://t.co/YSi6K1firY,https://twitter.com/dog_rates/status/793195938047070209/photo/1,12,10,Lily,114031,6547,17063,http://twitter.com/download/iphone,Twitter for iPhone,puppo
488,793180763617361921,,,2016-10-31 20:00:05,This is Newt. He's a strawberry. 11/10 https://t.co/2VhmlwxA1Q,https://twitter.com/dog_rates/status/793180763617361921/photo/1,11,10,Newt,114031,2310,7740,http://twitter.com/download/iphone,Twitter for iPhone,
489,793165685325201412,,,2016-10-31 19:00:10,This is Benji. He's Air Bud. It's a low effort costume but he pulls it off rather h*ckin well. 12/10 would happily get dunked on https://t.co/IbzT7DJvBo,https://twitter.com/dog_rates/status/793165685325201412/photo/1,12,10,Benji,114031,3238,10478,http://twitter.com/download/iphone,Twitter for iPhone,
490,793150605191548928,,,2016-10-31 18:00:14,This is Nida. She's a free elf. Waited so long for this day. 11/10 https://t.co/3lE8Izgmkf,https://twitter.com/dog_rates/status/793150605191548928/photo/1,11,10,Nida,114031,1984,6909,http://twitter.com/download/iphone,Twitter for iPhone,
491,793135492858580992,,,2016-10-31 17:00:11,Your favorite squad is looking extra h*ckin spooky today. 13/10 for all https://t.co/PrgvOyPtDT,https://twitter.com/dog_rates/status/793135492858580992/photo/1,13,10,,114031,2893,7214,http://twitter.com/download/iphone,Twitter for iPhone,
492,793120401413079041,,,2016-10-31 16:00:13,"This is Robin. She's desperately trying to do me a frighten, but her tongue drastically decreases her spook value. Still 11/10 great effort https://t.co/sxMrsOZ8zb",https://twitter.com/dog_rates/status/793120401413079041/photo/1,11,10,Robin,114031,4551,14202,http://twitter.com/download/iphone,Twitter for iPhone,
493,792913359805018113,,,2016-10-31 02:17:31,Here is a perfect example of someone who has their priorities in order. 13/10 for both owner and Forrest https://t.co/LRyMrU7Wfq,https://twitter.com/dog_rates/status/792913359805018113/photo/1,13,10,a,114031,4715,16063,http://twitter.com/download/iphone,Twitter for iPhone,
494,792883833364439040,,,2016-10-31 00:20:11,This is Bailey. She's rather h*ckin hype for Halloween tomorrow. Carved those pupkins herself. 12/10 https://t.co/v17mFm0Ftz,https://twitter.com/dog_rates/status/792883833364439040/photo/1,12,10,Bailey,114031,4964,12666,http://twitter.com/download/iphone,Twitter for iPhone,
495,792773781206999040,,,2016-10-30 17:02:53,This is Monster. Not an actual monster tho. He's showing you his tongue. Very impressive Monster. 12/10 would snug https://t.co/RhaPExuxJL,https://twitter.com/dog_rates/status/792773781206999040/photo/1,12,10,Monster,114031,1963,8209,http://twitter.com/download/iphone,Twitter for iPhone,
496,792394556390137856,,,2016-10-29 15:55:58,Meet BeBe. She rocks the messy bun of your dreams. H*ckin flawless. 12/10 would watch her tutorial https://t.co/of0pFNBIl8,https://twitter.com/dog_rates/status/792394556390137856/photo/1,12,10,BeBe,114031,4998,15128,http://twitter.com/download/iphone,Twitter for iPhone,
497,792050063153438720,,,2016-10-28 17:07:05,This is Remus. He's a mop that came to life. Can't see anything. Constantly trips over himself. Still a very good dog. 11/10 https://t.co/S3f1SYylzu,https://twitter.com/dog_rates/status/792050063153438720/photo/1,11,10,Remus,114031,2088,8029,http://twitter.com/download/iphone,Twitter for iPhone,
498,791672322847637504,,,2016-10-27 16:06:04,When she says you're a good boy and you know you're a good boy because you're a good boy. 13/10 https://t.co/O5IUmRHRIh,https://twitter.com/dog_rates/status/791672322847637504/photo/1,13,10,,114031,3661,13129,http://twitter.com/download/iphone,Twitter for iPhone,
499,791406955684368384,,,2016-10-26 22:31:36,Say hello to Levi. He's a Madagascan Butterbop. One of the more docile Butterbops I've seen. 12/10 would give all the pets https://t.co/Zcw9Sccctc,https://twitter.com/dog_rates/status/791406955684368384/photo/1,12,10,Levi,114031,4797,14670,http://twitter.com/download/iphone,Twitter for iPhone,
500,791312159183634433,,,2016-10-26 16:14:55,This is Mabel. She's super h*ckin smol. Portable af. Comes with the smol shoe. 12/10 would keep in frocket https://t.co/GGJvxYt3xK,https://twitter.com/dog_rates/status/791312159183634433/photo/1,12,10,Mabel,114031,2963,9841,http://twitter.com/download/iphone,Twitter for iPhone,
501,790987426131050500,,,2016-10-25 18:44:32,This is Misty. She has a cowboy hat on her nose. 12/10 https://t.co/Eno0mypHIr,https://twitter.com/dog_rates/status/790987426131050500/photo/1,12,10,Misty,114031,2483,11089,http://twitter.com/download/iphone,Twitter for iPhone,
502,790946055508652032,,,2016-10-25 16:00:09,This is Betty. She's assisting with the dishes. Such a good puppo. 12/10 h*ckin helpful af https://t.co/dgvTPZ9tgI,https://twitter.com/dog_rates/status/790946055508652032/photo/1,12,10,Betty,114031,5496,18601,http://twitter.com/download/iphone,Twitter for iPhone,puppo
503,790698755171364864,,,2016-10-24 23:37:28,This is Mosby. He appears to be rather h*ckin snuggable af. 12/10 keep it up Mosby https://t.co/IiiBq460I7,https://twitter.com/dog_rates/status/790698755171364864/photo/1,12,10,Mosby,114031,2203,9158,http://twitter.com/download/iphone,Twitter for iPhone,
504,790581949425475584,,,2016-10-24 15:53:19,This is Duke. He sneaks into the fridge sometimes. It's his safe place. 11/10 would give little jacket if necessary https://t.co/Fd5WFDTMH4,https://twitter.com/dog_rates/status/790581949425475584/photo/1,11,10,Duke,114031,8183,22473,http://twitter.com/download/iphone,Twitter for iPhone,
505,790337589677002753,,,2016-10-23 23:42:19,Meet Maggie. She can hear your cells divide. 12/10 can also probably fly https://t.co/ovE2hqXryV,https://twitter.com/dog_rates/status/790337589677002753/photo/1,12,10,Maggie,114031,2167,8740,http://twitter.com/download/iphone,Twitter for iPhone,
506,790277117346975746,,,2016-10-23 19:42:02,This is Bruce. He never backs down from a challenge. 11/10 you got this Bruce https://t.co/aI7umZHIq7,https://twitter.com/dog_rates/status/790277117346975746/photo/1,11,10,Bruce,114031,3732,14081,http://twitter.com/download/iphone,Twitter for iPhone,
507,789986466051088384,,,2016-10-23 00:27:05,This is Happy. He's a bathtub reviewer. Seems to be pleased with this one. 12/10 https://t.co/Ln89R4FP7v,https://twitter.com/dog_rates/status/789986466051088384/photo/1,12,10,Happy,114031,2704,10369,http://twitter.com/download/iphone,Twitter for iPhone,
508,789628658055020548,,,2016-10-22 00:45:17,This is Eli. He can fly. 13/10 magical af https://t.co/huPSJJ7FDI,https://twitter.com/dog_rates/status/789628658055020548/photo/1,13,10,Eli,114031,2080,8448,http://twitter.com/download/iphone,Twitter for iPhone,
509,789599242079838210,,,2016-10-21 22:48:24,This is Brownie. She's wearing a Halloween themed onesie. 12/10 festive af https://t.co/0R4meWXFOx,https://twitter.com/dog_rates/status/789599242079838210/photo/1,12,10,Brownie,114031,2279,7620,http://twitter.com/download/iphone,Twitter for iPhone,
510,789530877013393408,,,2016-10-21 18:16:44,This is Rizzy. She smiles a lot. 12/10 contagious af https://t.co/TU4sZogVIq,https://twitter.com/dog_rates/status/789530877013393408/photo/1,12,10,Rizzy,114031,3942,13188,http://twitter.com/download/iphone,Twitter for iPhone,
511,789268448748703744,,,2016-10-21 00:53:56,This is Stella. She's happier than I will ever be. 10/10 would trade lives with https://t.co/JSs2bfDtTS,https://twitter.com/dog_rates/status/789268448748703744/photo/1,10,10,Stella,114031,3014,10196,http://twitter.com/download/iphone,Twitter for iPhone,
512,789137962068021249,,,2016-10-20 16:15:26,This is Bo. He's a West Congolese Bugaboop Snuggle. Rather exotic. Master of the head tilt. 12/10 would pay to pet https://t.co/2jwxxtNzoN,https://twitter.com/dog_rates/status/789137962068021249/photo/1,12,10,Bo,114031,3244,10875,http://twitter.com/download/iphone,Twitter for iPhone,
513,788908386943430656,,,2016-10-20 01:03:11,"This is Lucy. She destroyed not one, but two remotes trying to turn off the debate. 11/10 relatable af https://t.co/3BXh073tDm",https://twitter.com/dog_rates/status/788908386943430656/photo/1,11,10,Lucy,114031,14409,30653,http://twitter.com/download/iphone,Twitter for iPhone,
514,788765914992902144,,,2016-10-19 15:37:03,This is Butter. She can have whatever she wants forever. 12/10 would hug softly https://t.co/x5gXRS1abq,https://twitter.com/dog_rates/status/788765914992902144/photo/1,12,10,Butter,114031,12014,30658,http://twitter.com/download/iphone,Twitter for iPhone,
515,788412144018661376,,,2016-10-18 16:11:17,This is Dexter. He breaks hearts for a living. 11/10 h*ckin handsome af https://t.co/4DhSsC1W7S,https://twitter.com/dog_rates/status/788412144018661376/photo/1,11,10,Dexter,114031,5990,16060,http://twitter.com/download/iphone,Twitter for iPhone,
516,788178268662984705,,,2016-10-18 00:41:57,Atlas is back and this time he's got doggles. Still 13/10 solarly conscious af https://t.co/s7MgFWDySc,https://twitter.com/dog_rates/status/788178268662984705/photo/1,13,10,,114031,2488,8100,http://twitter.com/download/iphone,Twitter for iPhone,
517,788150585577050112,,,2016-10-17 22:51:57,This is Leo. He's a golden chow. Rather h*ckin rare. 13/10 would give extra pats https://t.co/xosHjFzVXc,https://twitter.com/dog_rates/status/788150585577050112/photo/1,13,10,Leo,114031,1510,6865,http://twitter.com/download/iphone,Twitter for iPhone,
518,788039637453406209,,,2016-10-17 15:31:05,Did... did they pick out that license plate? 12/10 for both https://t.co/lRmUUOxgbQ,https://twitter.com/dog_rates/status/788039637453406209/photo/1,12,10,,114031,1535,6867,http://twitter.com/download/iphone,Twitter for iPhone,
519,787810552592695296,,,2016-10-17 00:20:47,This is Frank. He wears sunglasses and walks himself. 11/10 I'll never be this cool or independent https://t.co/pNNjBtHWPc,https://twitter.com/dog_rates/status/787810552592695296/photo/1,11,10,Frank,114031,3540,9717,http://twitter.com/download/iphone,Twitter for iPhone,
520,787717603741622272,,,2016-10-16 18:11:26,This is Tonks. She is a service puppo. Can hear a caterpillar hiccup from 7 miles away. 13/10 would follow anywhere https://t.co/i622ZbWkUp,https://twitter.com/dog_rates/status/787717603741622272/photo/1,13,10,Tonks,114031,3240,11416,http://twitter.com/download/iphone,Twitter for iPhone,puppo
521,787397959788929025,,,2016-10-15 21:01:17,This is Moose. He's rather h*ckin dangerous (you can tell by the collar). 11/10 would still attempt to snug https://t.co/lHVHGdDzb3,https://twitter.com/dog_rates/status/787397959788929025/photo/1,11,10,Moose,114031,3300,12120,http://twitter.com/download/iphone,Twitter for iPhone,
522,787322443945877504,,,2016-10-15 16:01:13,This is Lincoln. He forgot to use his blinker when he changed lanes just now. Guilty as h*ck. Still 10/10 https://t.co/lsrR83SiVp,https://twitter.com/dog_rates/status/787322443945877504/photo/1,10,10,Lincoln,114031,2032,8726,http://twitter.com/download/iphone,Twitter for iPhone,
523,786963064373534720,,,2016-10-14 16:13:10,This is Rory. He's got an interview in a few minutes. Looking spiffy af. Nervous as h*ck tho. 12/10 would hire https://t.co/ibj5g6xaAj,https://twitter.com/dog_rates/status/786963064373534720/photo/1,12,10,Rory,114031,9327,29725,http://twitter.com/download/iphone,Twitter for iPhone,
524,786709082849828864,,,2016-10-13 23:23:56,"This is Logan, the Chow who lived. He solemnly swears he's up to lots of good. H*ckin magical af 9.75/10 https://t.co/yBO5wuqaPS",https://twitter.com/dog_rates/status/786709082849828864/photo/1,75,10,Logan,114031,7069,20296,http://twitter.com/download/iphone,Twitter for iPhone,
525,786664955043049472,,,2016-10-13 20:28:35,"""Honestly Kathleen I just want more Ken Bone"" 12/10 https://t.co/HmlEvAMP4r",https://twitter.com/dog_rates/status/786664955043049472/photo/1,12,10,,114031,2996,11957,http://twitter.com/download/iphone,Twitter for iPhone,
526,786595970293370880,,,2016-10-13 15:54:28,This is Dale. He's a real spookster. Did me quite the frighten. 11/10 not too spooky to pet tho https://t.co/L8BWDD4oBX,https://twitter.com/dog_rates/status/786595970293370880/photo/1,11,10,Dale,114031,3601,10497,http://twitter.com/download/iphone,Twitter for iPhone,
527,786363235746385920,,,2016-10-13 00:29:39,This is Rizzo. He has many talents. A true renaissance doggo. 13/10 entertaining af https://t.co/TVXpEJB7Wn,https://twitter.com/dog_rates/status/786363235746385920/photo/1,13,10,Rizzo,114031,4072,12189,http://twitter.com/download/iphone,Twitter for iPhone,doggo
528,786233965241827333,,,2016-10-12 15:55:59,This is Mattie. She's extremely dangerous. Will bite your h*ckin finger right off. Still 11/10 would pet with caution https://t.co/78c9W8kLFh,https://twitter.com/dog_rates/status/786233965241827333/photo/1,11,10,Mattie,114031,5571,17178,http://twitter.com/download/iphone,Twitter for iPhone,
529,786051337297522688,7.727430194476073e+17,7.305050141505823e+17,2016-10-12 03:50:17,13/10 for breakdancing puppo @shibbnbot,,13,10,,114031,179,1614,http://twitter.com/download/iphone,Twitter for iPhone,puppo
530,785927819176054784,,,2016-10-11 19:39:28,This is Lucy. She's strives to be the best potato she can be. 12/10 would boop https://t.co/lntsj7Fc4Y,https://twitter.com/dog_rates/status/785927819176054784/photo/1,12,10,Lucy,114031,3652,12696,http://twitter.com/download/iphone,Twitter for iPhone,
531,785872687017132033,,,2016-10-11 16:00:24,Meet Rusty. He appears to be rather h*ckin fluffy. Also downright adorable af. 12/10 would rub my face against his https://t.co/1j9kLGb4wV,https://twitter.com/dog_rates/status/785872687017132033/video/1,12,10,Rusty,114031,2130,7489,http://twitter.com/download/iphone,Twitter for iPhone,
532,785533386513321988,,,2016-10-10 17:32:08,This is Dallas. Her tongue is ridiculous. 11/10 h*ckin proud af https://t.co/h4jhlH4EyG,https://twitter.com/dog_rates/status/785533386513321988/photo/1,11,10,Dallas,114031,2334,10183,http://twitter.com/download/iphone,Twitter for iPhone,
533,785515384317313025,,,2016-10-10 16:20:36,"Today, 10/10, should be National Dog Rates Day",,10,10,,114031,1477,6800,http://twitter.com/download/iphone,Twitter for iPhone,
534,785264754247995392,,,2016-10-09 23:44:41,This is Doc. He requested to be carried around like that. 12/10 anything for Doc https://t.co/mWYACm4qnx,https://twitter.com/dog_rates/status/785264754247995392/photo/1,12,10,Doc,114031,1911,8128,http://twitter.com/download/iphone,Twitter for iPhone,
535,785170936622350336,,,2016-10-09 17:31:53,This is Hero. He was enjoying the car ride until he remembered that bees are dying globally at an alarming rate. 11/10 https://t.co/cubFg7F4qQ,https://twitter.com/dog_rates/status/785170936622350336/photo/1,11,10,Hero,114031,5639,13491,http://twitter.com/download/iphone,Twitter for iPhone,
536,784826020293709826,,,2016-10-08 18:41:19,This is Rusty. He's going D1 for sure. Insane vertical. 13/10 would draft https://t.co/AsykOwMrXQ,https://twitter.com/dog_rates/status/784826020293709826/photo/1,13,10,Rusty,114031,3712,11310,http://twitter.com/download/iphone,Twitter for iPhone,
537,784517518371221505,,,2016-10-07 22:15:26,This is Frankie. He has yet to learn how to control his tongue. 11/10 maybe one day https://t.co/p6fgYe2dB6,https://twitter.com/dog_rates/status/784517518371221505/photo/1,11,10,Frankie,114031,2970,10039,http://twitter.com/download/iphone,Twitter for iPhone,
538,784431430411685888,,,2016-10-07 16:33:21,This is Stormy. He's curly af. Already pupared for Coachella next year. 12/10 https://t.co/PHA1vtqqpt,https://twitter.com/dog_rates/status/784431430411685888/photo/1,12,10,Stormy,114031,1491,6329,http://twitter.com/download/iphone,Twitter for iPhone,
539,783839966405230592,,,2016-10-06 01:23:05,This is Riley. His owner put a donut pillow around him and he loves it so much he won't let anyone take it off. 13/10 https://t.co/8TCQcsZCZ8,https://twitter.com/dog_rates/status/783839966405230592/photo/1,13,10,Riley,114031,12643,33689,http://twitter.com/download/iphone,Twitter for iPhone,
540,783821107061198850,,,2016-10-06 00:08:09,This is Mairi. She has mastered the art of camouflage. 12/10 h*ckin sneaky af https://t.co/STcPjiNAHp,https://twitter.com/dog_rates/status/783821107061198850/photo/1,12,10,Mairi,114031,2269,8209,http://twitter.com/download/iphone,Twitter for iPhone,
541,783695101801398276,,,2016-10-05 15:47:27,This is Loomis. He's the leader of the Kenneth search party. The passion is almost overwhelming. 12/10 one day he will be free https://t.co/kCRKlFg4AY,https://twitter.com/dog_rates/status/783695101801398276/photo/1,12,10,Loomis,114031,3737,11650,http://twitter.com/download/iphone,Twitter for iPhone,
542,783466772167098368,,,2016-10-05 00:40:09,This is Finn. He likes eavesdropping from filing cabinets. It's a real issue but no one has approached him about it. 11/10 would still pet https://t.co/s8W8Del9HQ,https://twitter.com/dog_rates/status/783466772167098368/photo/1,11,10,Finn,114031,2608,9468,http://twitter.com/download/iphone,Twitter for iPhone,
543,783391753726550016,,,2016-10-04 19:42:03,Meet Godi. He's an avid beachgoer and part time rainbow summoner. Eyeliner flawless af. 13/10 would snug well https://t.co/BO936YdJdi,https://twitter.com/dog_rates/status/783391753726550016/photo/1,13,10,Godi,114031,6441,18908,http://twitter.com/download/iphone,Twitter for iPhone,
544,783334639985389568,,,2016-10-04 15:55:06,This is Dave. He's currently in a predicament. Doesn't seem to mind tho. 12/10 someone assist Dave https://t.co/nfprKAXqwu,https://twitter.com/dog_rates/status/783334639985389568/photo/1,12,10,Dave,114031,13616,32651,http://twitter.com/download/iphone,Twitter for iPhone,
545,783085703974514689,,,2016-10-03 23:25:55,This is Earl. He can't catch. Did his best tho. 11/10 would repair confidence with extra pats https://t.co/IsqyvbjFgM,https://twitter.com/dog_rates/status/783085703974514689/photo/1,11,10,Earl,114031,2565,9112,http://twitter.com/download/iphone,Twitter for iPhone,
546,782969140009107456,,,2016-10-03 15:42:44,This is Cali. She arrived preassembled. Convenient af. 12/10 appears to be rather h*ckin pettable https://t.co/vOBV1ZqVcX,https://twitter.com/dog_rates/status/782969140009107456/photo/1,12,10,Cali,114031,8521,26949,http://twitter.com/download/iphone,Twitter for iPhone,
547,782747134529531904,,,2016-10-03 01:00:34,This is Deacon. He's the happiest almost dry doggo I've ever seen. 11/10 would smile back https://t.co/C6fUMnHt1H,https://twitter.com/dog_rates/status/782747134529531904/photo/1,11,10,Deacon,114031,1604,8310,http://twitter.com/download/iphone,Twitter for iPhone,doggo
548,782722598790725632,,,2016-10-02 23:23:04,"This is Penny. She fought a bee and the bee won. 10/10 you're fine Penny, everything's fine https://t.co/zrMVdfFej6",https://twitter.com/dog_rates/status/782722598790725632/photo/1,10,10,Penny,114031,6238,19250,http://twitter.com/download/iphone,Twitter for iPhone,
549,782598640137187329,,,2016-10-02 15:10:30,This is Timmy. He's quite large. According to a trusted source it's actually a dog wearing a dog suit. 11/10 https://t.co/BIUchFwHqn,https://twitter.com/dog_rates/status/782598640137187329/photo/1,11,10,Timmy,114031,2184,8694,http://twitter.com/download/iphone,Twitter for iPhone,
550,782305867769217024,,,2016-10-01 19:47:08,This is Sampson. He just graduated. Ready to be a doggo now. Time for the real world. 12/10 have fun with taxes https://t.co/pgVKxRw0s1,https://twitter.com/dog_rates/status/782305867769217024/photo/1,12,10,Sampson,114031,6470,18630,http://twitter.com/download/iphone,Twitter for iPhone,doggo
551,781955203444699136,,,2016-09-30 20:33:43,This is Chipson. He weighed in at .3 ounces and is officially super h*ckin smol. Space-saving af. 11/10 would snug delicately https://t.co/FjEsk7A1JV,https://twitter.com/dog_rates/status/781955203444699136/photo/1,11,10,Chipson,114031,3920,12357,http://twitter.com/download/iphone,Twitter for iPhone,
552,781661882474196992,,,2016-09-30 01:08:10,Who keeps sending in pictures without dogs in them? This needs to stop. 5/10 for the mediocre road https://t.co/ELqelxWMrC,https://twitter.com/dog_rates/status/781661882474196992/photo/1,5,10,,114031,3129,11634,http://twitter.com/download/iphone,Twitter for iPhone,
553,781524693396357120,,,2016-09-29 16:03:01,Idk why this keeps happening. We only rate dogs. Not Bangladeshi Couch Chipmunks. Please only send dogs... 12/10 https://t.co/ya7bviQUUf,https://twitter.com/dog_rates/status/781524693396357120/photo/1,12,10,,114031,6426,23163,http://twitter.com/download/iphone,Twitter for iPhone,
554,781251288990355457,,,2016-09-28 21:56:36,This is Oakley. He just got yelled at for going 46 in a 45. Churlish af. 11/10 would still pet so well https://t.co/xIYsa6LPA4,https://twitter.com/dog_rates/status/781251288990355457/photo/1,11,10,Oakley,114031,2458,9428,http://twitter.com/download/iphone,Twitter for iPhone,
